nama,klasifikasi
quality fresh timun jepang kyuri organik,0
quality fresh timun lokal organik,0
quality fresh tomat buah organik,0
quality fresh tomat cherry organik,0
quality fresh tomat recento,0
quality fresh ubi cilembu,0
quality fresh ubi jepang ungu,0
quality fresh wortel baby organik,0
sayur segar bayam hijau,0
sayur segar buncis,0
sayur segar kangkung,0
sayur segar kentang,0
sayur segar kol putih,0
sayur segar sawi putih,0
sayur segar timun lokal,0
sayur segar tomat,0
sayur segar wortel,0
simply fresh basil,0
simply fresh bayam hijau,0
simply fresh bit,0
simply fresh buncis lokal,0
simply fresh caisim,0
simply fresh daun bawang,0
simply fresh daun ginseng,0
simply fresh daun ketumbar,0
simply fresh daun lobak,0
simply fresh daun mint,0
simply fresh horenzo,0
simply fresh jagung manis,0
simply fresh kailan,0
simply fresh kangkung,0
simply fresh kol putih,0
simply fresh labu butternut,0
simply fresh labu siam baby,0
simply fresh labu siam sedang,0
simply fresh lidah buaya,0
simply fresh lobak,0
simply fresh marjoram,0
simply fresh oregano,0
simply fresh pak choy,0
simply fresh sage,0
simply fresh selada air,0
simply fresh selada keriting,0
simply fresh selada romaine,0
simply fresh seledri,0
simply fresh tarragon,0
simply fresh terong ungu,0
simply fresh thyme,0
simply fresh timun kyuri  jepang,0
simply fresh timun lokal,0
simply fresh wortel besar,0
simply fresh zukini,0
sj bawang bombay,0
sj bawang putih,0
sj brokoli,0
sj jahe,0
sj jeruk nipis,0
sj jeruk purut,0
sj kemiri,0
sj ketumbar,0
sj sayur bayam hijau,0
sj sayur bayam merah,0
sj sayur buncis sayur,0
sj sayur daun pandan,0
sj sayur kacang panjang biasa,0
sj sayur kangkung akar,0
sj sayur kentang besar,0
sj sayur kol putih,0
sj sayur labu butter nut,0
sj sayur labu siam,0
sj sayur lencah sayur,0
sj sayur oyong gambas,0
sj sayur pakcoy,0
sj sayur pare putih,0
sj sayur sawi hijau  caisim,0
sj sayur sawi putih,0
sj sayur selada air,0
sj sayur selada hijau,0
sj sayur selada merah,0
sj sayur seledri biasa,0
sj sayur tauge kecambah panjang,0
sj sayur tauge kecambah pendek,0
sj sayur terong ungu panjang,0
sj sayur timun baby,0
sj sayur timun biasa,0
sj sayur timun jepang kiyuri,0
sj sayur wortel sayur,0
vegas bawang bombay,0
vegas bawang putih,0
vegas brokoli,0
vegas buncis biasa,0
vegas gambasoyong,0
vegas jagung lokal,0
vegas kembang kol,0
vegas kentang,0
vegas kubis,0
vegas pakcoy,0
vegas pakcoy baby,0
vegas pare,0
vegas sawi putih,0
vegas terong hijau,0
vegas timun baby,0
vegas timun lokal,0
vegas tomat,0
vegas wortel lokal,0
amazing farm tempe sehat non gmo,0
bibik sayur onl bawang merah fresh,0
bibik sayur onl bawang putih fresh,0
bibik sayur onl cabe merah keriting,0
bibik sayur onl cabe rawit merah,0
bibik sayur onl kacang panjang fresh,0
bibik sayur onl kembang kol fresh,0
bibik sayur onl kentang lokal,0
bibik sayur onl kol putih,0
bibik sayur onl labu siam,0
bibik sayur onl lodeh fresh,0
bibik sayur onl sawi putih,0
bibik sayur onl sayur asem fresh,0
bibik sayur onl sayur bayam hijau fresh,0
bibik sayur onl sayur caisim fresh,0
bibik sayur onl sayur kangkung fresh,0
bibik sayur onl sayur packhoy fresh,0
bibik sayur onl sayur sop fresh,0
bibik sayur onl sereh bumbu fresh,0
bibik sayur onl terong ungu,0
bibik sayur onl tomat fresh,0
bibik sayur onl wortel,0
cetroland tahu kuning,0
cetroland tahu putih,0
lumbung segar tahu bungkus,0
lumbung segar tahu yunyi kims kuning,0
lumbung segar tahu yunyi kims putih,0
lumbung segar tempe,0
lumbung segar tempe mendoan,0
sayur racik bening bayam jagung,0
sayur racik bening katu jagung,0
sayur racik gulai daun ubi,0
sayur racik sambal buncis ati ampela,0
sayur racik sambal kentang,0
sayur racik sambal teri pete,0
sayur racik sambal terong,0
sayur racik sayur asem,0
sayur racik sayur lodeh,0
sayur racik sayur sop,0
sayur racik sop telor puyuh,0
sayur racik tumis cambah panjang teri,0
sayur racik tumis kacang panjang teri,0
sayur racik tumis kangkung teri,0
sayur racik tumis labu siam teri,0
sayur racik tumis sawi putih teri,0
sayur racik tumis tahu toge teri,0
sepang jaya bayam batik hydroponic,0
sepang jaya bayam brazil hydroponic,0
sepang jaya bayam hijau hydroponic,0
sepang jaya caisim hydroponic,0
sepang jaya daun bawang hydroponic,0
sepang jaya daun mint hydroponic,0
sepang jaya kailan hydroponic,0
sepang jaya kale nero hydroponic,0
sepang jaya kangkung hydroponic,0
sepang jaya pakcoy hijau hydroponic,0
sepang jaya sawi dakota hydroponic,0
sepang jaya sawi keriting hydroponic,0
sepang jaya selada romaine hydroponic,0
pokemon umbrella karakter,0
indomaret jas hujan disposable dewasa,0
indomaret jas hujan setelan,0
indomaret payung lipat,0
point coffee payung lipat,0
favour facial tissue prestige gentle soft,0
mitu baby fresh clean wipes blue blossom berry,0
dettol anti bakteri wet wipes sensitive,0
favour character facial tissue gentle touch,0
indomaret bamboo facial tissue,0
indomaret bamboo kitchen tissue,0
indomaret bamboo toilet tissue,0
indomaret facial tissue,0
indomaret wet tissue alcohol food grade,0
larisst baby wet wipes non alcohol,0
nuvo wet tissue fresh biru,0
nuvo wet tissue original merah,0
tessa facial tissue,0
tessa towel tissue nature,0
bebek semerbak pengharum flush refill lavender,0
mr.muscle pembersih dapur pump lemon,0
mr.muscle pembersih dapur pump orange,0
vanish penghilang noda cair pink,0
proclin penghilang noda baju putih dan berwarna,0
bebek kloset pembersih kloset pinus,0
bebek semerbak pengharum flush pine,0
bebek in tank pembersih kloset twinpack bluey,0
kiwi liquid shoe polish black,0
kao attack detergent powder hygiene,0
so klin smart detergent powder max clean,0
pledge furniture polish pump lemon,0
mr.muscle pembersih axi lantai marmer granit,0
downy softener mystique,0
harpic pembersih kloset penghancur kerak citrus,0
mama lemon cairan pencuci piring extra clean jeruk nipis,0
harpic pembersih kloset power plus orange,0
harpic pembersih kloset triple action power,0
downy softener passion,0
downy softener daring,0
so klin pewangi pakaian romantic pink,0
shock anti sumbat,0
vanish penghilang noda cair,0
vanish penghilang noda cair white,0
downy softener anti bau,0
downy softener mild gentle,0
bayclin pemutih pakaian regular,0
royale hijab softener black velvet,0
royale hijab softener blue sapphire,0
royale softener pink satin,0
so klin softergent powder magnolia berries,0
so klin softergent powder pink peony rose,0
so klin softergent powder purple lavender,0
so klin bio matic liquid front load,0
so klin pewangi pakaian refill pink,0
so klin pewangi pakaian refill violet,0
royale softener sunny day,0
royale softener sweet floral,0
so klin pewangi pakaian hijab refill green,0
so klin pewangi pakaian refill blue,0
so klin pewangi pakaian refill red,0
rinso deterjen powder molto purple,0
rinso deterjen powder molto rose fresh,0
downy softener fresh bouquet,0
so klin matic top and front load nature scent,0
daia detergent bubuk putih,0
so klin detergent cair anti bacterial,0
so klin detergent cair violet blossom,0
so klin detergent cair softergent,0
so klin softergent powder purple lavender lily,0
so klin softergent powder sakura strawberry,0
so klin detergent cair red scarlet blossom,0
so klin softergent powder soft sakura,0
wings supersol karbol wangi sereh,0
yuri pembersih porselin porstex non parfum,0
so klin detergent cair biomatic softener top front load flowers bloom,0
vanish penghilang noda powder oxi action,0
harpic pembersih kloset power plus citrus,0
harpic power clean disinfektan citrus,0
kao attack detergent cair batik care,0
vanish penghilang noda cair btl,0
harpic pembersih kloset triple action power,0
sos pembersih lantai sereh,0
gentle gen deterjen cair parisienne garden,0
mr.muscle glass pembersih kaca serbaguna original,0
downy softener sunrise fresh,0
downy softener anti apek,0
mr.muscle pembersih kaca serbaguna original,0
harpic pembersih kloset lemon fresh,0
so klin pembersih lantai citrus lemon,0
so klin pembersih lantai refill energizing apple,0
so klin pembersih lantai refill relaxing lavender,0
so klin pembersih lantai sereh,0
so klin softergent powder korean camelia,0
bebek karbol wangi sereh,0
daia detergent bubuk softener violet passion,0
wings porcelain cleaner biru,0
sos pembersih lantai refill apple,0
sos pembersih lantai refill orange,0
daia detergent bubuk fresh lemon,0
rapika pelicin pakaian biang 5 in 1 gold,0
daia detergent bubuk softener romantic pink,0
ekonomi pencuci piring power liquid jeruk nipis,0
mama lemon cairan pencuci piring ekstra clean jeruk nipis,0
so klin detergent cair clean action white bright,0
so klin detergent cair korean camellia,0
mama lime cairan pencuci piring refill,0
mama lime cairan pencuci piring refill green tea,0
ekonomi pencuci piring power liquid siwak jeruk limau,0
boom detergent bubuk bunga,0
bu krim cairan pencuci piring liquish jeruk nipis,0
bu krim detergent cair oxy klin,0
bu krim detergent oxy klin violet scent,0
bu krim detergent oxyklin romantic floral,0
daia detergent bubuk hijab clean fresh,0
daia detergent bubuk putih extrak pemutih,0
daia detergent bubuk romantic pink,0
daia detergent bubuk sensasi floral blossom,0
daia detergent bubuk violet passion,0
daia deterjen bubuk softener violet passion,0
dettol hygiene liquid lime,0
downy softener adorable bouquet,0
downy softener adorable bouquet pch,0
downy softener french lavender,0
downy softener pashmina rose,0
downy softener pure cotton,0
ekonomi pencuci piring power liquid sereh,0
ekonomi sabun cream lemon,0
gentle gen deterjen cair french peony,0
gentle gen deterjen cair morning breeze,0
harpic pembersih kamar mandi lime,0
harpic pembersih kloset power plus,0
indomaret cairan pencuci natural,0
indomaret detergent cair,0
indomaret detergent matic cair,0
indomaret karbol wangi,0
indomaret multi purpose cleaner,0
indomaret pembersih kaca,0
indomaret pembersih lantai green apple,0
indomaret pembersih lantai lavender,0
indomaret pembersih porselen,0
indomaret pencuci piring jeruk nipis,0
indomaret penghilang noda,0
indomaret pewangi pakaian pink passion,0
indomaret soft detergen zaitun sirih,0
kao attack detergent cair softener clean action,0
kao attack detergent cair easy sparkling bloom,0
kao attack detergent cair easy sweet glamour,0
kao attack detergent cair hygiene plus protection,0
kao attack detergent powder easy purple blossom,0
kao attack detergent powder easy sparkling bloom bag,0
kao attack detergent powder jaz 1 pesona segar,0
kao attack detergent powder jaz 1 semerbak cinta,0
kao attack detergent powder plus softener,0
kao attack deterjen powder jaz 1 pesona segar,0
kao attack fresh up softener joyful paradise,0
kao attack jaz 1 detergel pesona segar,0
kao attack jaz 1 detergel semerbak cinta,0
kao attack softener fresh up dazzling lilac,0
kispray pelicin pakaian fine perfume glamorous gold,0
kispray pelicin pakaian violet,0
kispray pengharum pakaian fine perfume elegant sapphire,0
kiwi paste black,0
lifebuoy pencuci piring lime,0
mama lemon cairan pencuci piring jeruk nipis,0
mama lemon cairan pencuci piring refill ekstrak lemon,0
mama lime cairan pencuci piring refill charcoal,0
max bio cairan pencuci piring jeruk nipis,0
molto pelembut pewangi pakaian casablanca lily,0
molto pelembut pewangi pakaian himalayan honeysuckle,0
molto pelembut pewangi pakaian korean strawberry,0
molto pewangi pakaian floral bliss blue,0
molto pewangi pakaian floral bliss blue,0
molto pewangi pakaian flower shower pink,0
molto pewangi pakaian flower shower pink,0
molto pewangi pakaian sport fresh purple,0
rapika pelicin pakaian pink sakura,0
rapika pelicin pakaian smart lovely lavender ungu refill,0
rinso detergen liquid micellar soft,0
rinso detergen powder anti noda molto korean strawberry,0
rinso deterjen cair molto perfume essence,0
rinso deterjen liquid molto korean strawberry,0
rinso deterjen liquid molto perfume essence,0
rinso deterjen liquid molto rose fresh,0
rinso deterjen liquid front load,0
rinso deterjen powder molto perfume essence,0
rinso deterjen powder molto pink,0
rinso deterjen powder anti noda,0
rinso deterjen powder molto,0
rinso matic deterjen molto,0
rinso molto detergent cair japanese peach,0
rinso molto deterjen cair royal gold,0
royale softener hot summer,0
royale softener lavender vanila,0
royale softener purple dawn,0
sayang deterjen liquid konsentrat original fresh,0
sayang deterjen liquid konsentrat rose,0
sayang deterjen powder original fresh,0
sayang deterjen powder rose,0
so klin detergen powder antisep,0
so klin detergent bio matic softener front load,0
so klin detergent cair provence lavender,0
so klin detergent cair scarlet blossom,0
so klin detergent cair softergent pink sakura,0
so klin pewangi pakaian pink,0
so klin pewangi pakaian refill active sport,0
so klin pewangi pakaian violet,0
so klin softergent powder rosy pink,0
so klin softergent powder velvet orchid,0
so soft deterjen cair floral berries,0
so soft deterjen cair nature fresh,0
so soft deterjen cair sweet bouquet,0
sos karbol wangi antibacterial classic pine,0
sunlight cairan pencuci piring jeruk nipis,0
sunlight pencuci piring habbatussauda,0
sunlight pencuci piring higienis habbatussauda,0
sunlight pencuci piring jeruk nipis,0
sunlight pencuci piring korean strawberry,0
sunlight pencuci piring lime,0
sunlight pencuci piring mint anti bau,0
super pell pembersih lantai anti bac citrus,0
super pell pembersih lantai fresh apple,0
super pell pembersih lantai lemon ginger,0
total detergent powder de perfumee,0
vixal pembersih kamar mandi kuat harum,0
vixal pembersih keramik pors biru,0
vixal pembersih porselin blue,0
wings supersol karbol wangi eucalyptus,0
wings supersol karbol wangi pine,0
wipol karbol sereh jeruk,0
wipol karbol wangi cemara,0
wipol karbol wangi lemon,0
wipol pembersih lantai cemara botol,0
wipol pembersih lantai classic pine,0
wipol pembersih lantai lemon pine,0
yuri pembersih porselin porstex ocean blue,0
yuri taf krim pembersih lemon lime,0
bebek in tank pembersih kloset bluey,0
bebek kamar mandi pembersih kamar mandi lavender,0
bebek kamar mandi pembersih kamar mandi lemon,0
bebek karbol pembersih serbaguna pinus,0
bebek kloset pembersih kloset extra kuatmint,0
bebek kloset pembersih kloset lemon,0
cif cream pembersih serbaguna lemon,0
cif cream pembersih serbaguna original,0
cling pembersih kaca pump biru,0
daia detergent bubuk floral blossom,0
daia detergent bubuk sensasi fresh lemon,0
ekonomi sabun cream reffil,0
larisst karbol sereh,0
larisst sabun pencuci piring jeruk nipis,0
molto eau de parfum luxury parfum,0
molto pelembut pewangi pakaian refill morning fresh,0
molto pelicin pewangi pakaian trika floral bliss,0
molto pelicin pewangi pakaian trika flower shower,0
molto softener pure,0
mr.muscle pembersih dapur reffil lemon,0
mr.muscle pembersih kamar mandi pump,0
mr.muscle pembersih kamar mandi refill,0
pledge furniture polish refill lemon,0
rapika pelicin pakaian korean camellia,0
so klin pembersih lantai moment in gold,0
so klin pembersih lantai purple twilight,0
so klin pembersih lantai rose bouquet,0
so klin pembersih lantai sakura blossom,0
so klin smart detergen powder color care,0
so klin smart detergent powder softener pink blossom,0
so klin softergent powder lavender lily,0
vanish penghilang noda cair pink white,0
wings pembersih kloset wpc,0
wipol pembersih lantai citrus fresh,0
yuri taf krim pembersih fresh blue,0
baygon insektisida spray yellow citrus fresh,0
autan lotion anti nyamuk sakura,0
force magic insektisida spray orange,0
swallow kamper fruit fresh,0
swallow kamper deodorizer ball,0
indomaret kamper toilet para colour ball,0
vape obat nyamuk spray fumakilla sakura blossom,0
bagus air freshener fresh luwak coffee,0
bagus para kamper,0
hit insektisida spray orange,0
vape obat nyamuk spray semprot sakura blossom,0
vape obat nyamuk spray semprot orange,0
bagus para hanger,0
bagus pengharum lemari fancys jasmine,0
bagus pengharum lemari fancys lavender,0
glade automatic spray refill ocean escape,0
baygon anti nyamuk cair elektrik lavender,0
bayfresh hang n go orange verbena,0
bayfresh hang n go strawberry bublegum,0
stella air freshener matic refill dream island,0
stella air freshener matic refill japanese sakura,0
bagus kamper para moth balls,0
stella naturals mini matic refill blue ocean,0
bagus serap air perfumed,0
bagus serap air perfumed refill,0
hit insektisida spray green forest,0
stella air fresh aerosol parfumist secret lavender,0
stella air freshener all in one caffe latte,0
stella air freshener matic refill perfect summer,0
stella fabric spray cotton bloom,0
stella fabric spray pink peony,0
stella fresh protect aerosol fresh floral,0
gajah kulkas penghilang bau lemari es,0
bagus anti bau sepatu,0
vape obat nyamuk purple orchid,0
vape obat nyamuk lemon,0
glade air freshner scented gel lavender,0
secret clean liquid toilet seat,0
force magic microns insektisida lemon scent,0
stella naturals mini matic refill elation,0
stella naturals mini matic refill green fantasy,0
bayfresh reed diffuser refill sakura bloom,0
glade automatic spray refill vanila oud wood,0
glade automatic spray refill wild berries,0
vape plus obat nyamuk spray fumakilla lavender,0
force magic insektisida spray fragrance green apple,0
bayfresh reed diffuser amber lavender,0
bayfresh reed diffuser yuzu peach,0
vape obat nyamuk orange,0
bayfresh reed diffuser sakura bloom,0
hoy hoy trap a roach,0
autan all night lotion anti nyamuk lavender,0
autan lotion anti nyamuk jeruk lemon,0
bagus kapur ajaib,0
bagus lem ajaib perangkap tikus,0
bayfresh car freshener everywhere cappuccino coffee,0
bayfresh hang n go dark ice,0
bayfresh hang n go sakura bloom,0
baygon anti nyamuk cair elektrik orange blossom,0
baygon insektisida spray anti nyamuk cherry blossom,0
baygon insektisida spray anti nyamuk fruity breeze,0
baygon insektisida spray anti nyamuk japanese peach,0
baygon insektisida spray anti nyamuk zen garden,0
baygon insektisida spray citrus fresh,0
baygon insektisida spray flower garden,0
baygon insektisida spray lavender,0
baygon liquid elektrik alat 2 in 1,0
baygon obat nyamuk bakar jumbo,0
dora racun tikus,0
force magic insektisida spray lemon,0
gajah lem tikus kotak,0
glade air freshener car gel coffee,0
glade air freshener ocean escape,0
glade air freshener one for all aroma terapi exotic flowers,0
glade air freshener one for all peonybery blis,0
hit alat anti nyamuk elektrik kotak,0
hit anti nyamuk refill expert fresh,0
hit anti nyamuk xpress alatrefill expert apple,0
hit insektisida spray expert pink blossom,0
hit insektisida spray lily blossom,0
hit insektisida spray lily blossom,0
hit magic expert anti nyamuk bakar floral blossom,0
hit mat elektrik anti nyamuk classic,0
indomaret air freshener fresh lemon,0
indomaret air freshener sweet orange,0
indomaret kamper butir putih naphthalene,0
indomaret karbol sereh citronella oil,0
kagumi deo scent coffee,0
king kong obat nyamuk bakar jumbo,0
soffell lotion anti nyamuk apel,0
soffell lotion anti nyamuk korean summer,0
soffell lotion anti nyamuk kulit jeruk,0
stella air fresh aerosol parfumist caffe latte,0
stella air freshener alat matic,0
stella air freshener all in one lemon,0
stella air freshener all in one orange,0
stella air freshener matic reffil green fantasy,0
stella air freshener matic reffil wild flower,0
stella air freshener matic refill caffe latte,0
stella air freshener matic refill fruit fiesta,0
stella air freshener orange,0
stella pocket bathroom perfume blue,0
stella pocket bathroom perfume orange,0
stella pocket bathroom perfume purple,0
swallow deodorant orange,0
swallow deodorizer lemon,0
swallow kamper butir putih,0
swallow toilet colour ball,0
vape liquid elektrik cair cld,0
vape obat nyamuk green tea,0
vape obat nyamuk spray fumakilla orange,0
vape obat nyamuk spray fumakilla sweet powder,0
vape plus obat nyamuk spray fumakilla orange,0
vape ultra liquid anti nyamuk ,0
wiz24 disinfecting spray,0
ambi pur car freshener vanilla bouquet,0
autan losion anti nyamuk hijau,0
autan lotion anti nyamuk ss floral protect,0
bagus anti bau kulkas,0
bagus anti bau toilet,0
bagus miko kamper lavender,0
bagus pengharum lemari fancys rose,0
bayfresh air freshener pop scent clean,0
bayfresh air freshener pop scent joy,0
bayfresh air freshener pop scent lovely,0
bayfresh air freshener pop scent pretty,0
bayfresh air freshener spray morning coffee,0
bayfresh reed diffuser refill amber lavender,0
bayfresh reed diffuser refill yuzu citron,0
bayfresh reed diffuser vanilla bean,0
baygon insectisida spray anti kecoa lavender,0
baygon liquid elektrik refill silky jasmine,0
baygon obat nyamuk bakar jumbo lavender,0
force magic insektisida spray fragrance floral,0
force magic insektisida spray fragrance lemon,0
force magic microns lemon scent,0
gajah lemari penghilang bau lemari,0
gajah perangkap tikus,0
gajah toilet penghilang bau toilet fumakila,0
glade automatic spray alat refill,0
glade automatic spray refill lavender vanila,0
glade automatic spray refill lemon,0
glade automatic spray refill white lilac,0
glade bathroom fresh lavender mist,0
glade bathroom fresh lemon zest,0
glade toilet fresh alat lavender,0
glade toilet fresh refill lavender,0
hit anti kecoa gel,0
hit insektisida spray expert citrus,0
kagumi deo scent thai mango,0
medpro sanitizing fabric spray,0
mr.muscle toilet cleaning gel alat refill lavender,0
mr.muscle toilet cleaning gel reffil citrus,0
secret clean baby liquid cleanser,0
stella air fresh aerosol parfumist cananga lullaby,0
stella air fresh aerosol parfumist warm verbena,0
stella air freshener all in one lavender garden,0
stella air freshener matic cananga lullaby,0
stella air freshener matic warm verbena,0
stella air freshener with natural oil apple,0
stella air freshener with natural oil japanese sakura,0
stella daily freshness indoor dream,0
stella daily freshness indoor vanilla,0
stella daily freshness orange blossom,0
stella daily freshness red kiss,0
stella fresh protec matic refill fresh citrus,0
stella fresh protec matic refill fresh floral,0
stella mini matic alat,0
vape liquid anti nyamuk sakura blossom,0
vape obat nyamuk spray fumakilla green tea,0
vape obat nyamuk spray fumakilla lavender,0
b6 essential christmas double wall mug,0
b6 essential christmas tumbler,0
pokemon mug bulbasaur,0
pokemon mug pikachu,0
energizer battery alkalin max,0
eveready battery hitam,0
energizer battery lithium,0
panasonic battery aaa,0
eveready battery 1222,0
kenmaster sarung tangan karet assorted,0
abc battery super power,0
energizer battery alkaline max aaalr3,0
abc battery super power aaar03,0
command hook,0
scotch brite bath scrub handle,0
kenmaster water filter air daiyu,0
scotch brite moppel katun kotak medium set,0
abc battery alkaline millennium power,0
abc battery alkaline aaalr032s millennium power,0
abc battery alkaline aaalr 034s millennium,0
abc battery alkaline aa lr62s millennium power,0
abc battery alkaline aa lr64s millennium power,0
abc battery super power,0
bagus kain lap serbaguna mikrofiber,0
bagus sikat baju,0
bagus sikat lantai,0
fresh care telon patch,0
hot wheels mobil basic assortment,0
indomaret dental floss pick,0
indomaret garpu plastik,0
indomaret gelas kertas,0
indomaret keset handuk,0
indomaret mangkok kertas,0
indomaret mangkok plastik,0
indomaret payung panjang warna warni,0
indomaret piring kertas,0
indomaret piring plastik,0
indomaret plastik sampah,0
indomaret sedotan kertas,0
indomaret sendok plastik,0
indomaret sponge mandi,0
indomaret tas ramah lingkungan warna random,0
kenmaster kran plastik putih,0
kiky kertas kado 3 in 1 bunga,0
kiky kertas kado 3 in 1 character,0
kiky kertas kado 3 in 1 matt,0
klik indomaret tas ramah lingkungan parasut,0
panasonic battery prima,0
panasonic battery remote,0
pokemon key chain karakter,0
pokemon mug karakter,0
pokemon tote bag karakter,0
scotch brite easy clean scrub sponge,0
scotch brite sabut jaring,0
scotch brite sapu nylon kipas,0
scotch brite scrub dots heavy duty,0
scotch brite sikat lantai medium,0
scotch brite tough clean scrub sponge,0
aa merah karet gelang,0
abc battery biru besar,0
abc battery biru,0
aristan hand gloves,0
avenue keset handuk premium,0
b6 essential bag holder hook,0
bagus kitchenware penjepit serbaguna,0
bagus micromate sarung tangan microfiber,0
bagus sarung tangan plastik,0
bagus shoe brush,0
bagus yamazaki gunting dapur,0
bolde super fry pan beige,0
bolde super pan wok beige,0
bolde super utensile skimmer beige,0
bolde super utensile turner spatula beige,0
cap gajah kertas nasi,0
castol lem contact adhesive,0
centong nasi anti lengket,0
citinova gelas picca,0
citinova gelas siena,0
claris armax box,0
claris ember,0
claris kotak rectangular,0
claris rc foodsaver,0
claris round toples,0
claris seal ware bio sense,0
claris talenan anti bakteri delica,0
claris tempat roti muffin,0
claris tiry mesh small,0
cooger 2 pieceset detachable broom set blue,0
cooger 30 clip color windproof plastik basket blue,0
cooger disc multi slot toothbrush rak dark blue,0
cooger mop green,0
cooger roller type powerful punch fre mop holder blue,0
cooger toilet brush gray white,0
cooger wall mounted soap dispenser white grey,0
energizer battery alkalin max aalr6,0
energizer battery alkaline max aaalr3,0
eveready battery hitam aaa,0
eveready senter led,0
freemir wheat straw bowl,0
freemir wheat straw cold kettle set,0
freemir wheat straw plate,0
freemir wheat straw round plate,0
freemir wheat straw tray set,0
gunung sewu sapu ijuk,0
indomaret alat pel,0
indomaret alat pel refill,0
indomaret dental tooth picks brush,0
indomaret food saver,0
indomaret kain lap pel,0
indomaret lap serbaguna,0
indomaret lighter batik,0
indomaret lighter elektrik,0
indomaret lighter motif assorted,0
indomaret lighter solid,0
indomaret lilin putih jumbo,0
indomaret lilin ulang tahun,0
indomaret pisau sarung,0
indomaret plastik hdpe,0
indomaret plastik klip polos,0
indomaret sabut stainless,0
indomaret sapu ijuk,0
indomaret serbet handuk,0
indomaret sponge mandi long puff,0
indomaret spons busa,0
indomaret tusuk gigi,0
indomaret tusuk gigi travel,0
indomaret zipper bag,0
kenmaster gas torch,0
kenmaster gas torch,0
