nama,klasifikasi
delfi chocolate dairy milk,1
delfi chocolate wafer take it 4 fingers,1
delfi custas soft cup cake orion,1
delfi wafer stick twister minis black vanilla,1
delfi wafer stick twister minis choco cream,1
delmonte boba coffee caramel cheese,1
delmonte boba milk tea matcha,1
delmonte boba milk tea red velvet,1
delmonte boba milk tea taro,1
diasweet fiberwafer chocolate,1
dilan choco crunchy caramel,1
dj minuman kesehatan alami belimbing wuluh,1
donald yogu,1
dua kelinci fuzo kuaci milk,1
dua kelinci jagung presto bawang putih,1
dua kelinci jagung presto pedas manis,1
dua kelinci kacang garing,1
dua kelinci kacang kulit bawang putih,1
dua kelinci kacang lofet daun jeruk,1
dua kelinci kacang mix nut,1
dua kelinci kacang polong polongku original,1
dua kelinci kacang polong polongmas ayam bawang,1
dua kelinci kacang polong polongmas barbeque,1
dua kelinci kacang sangrai,1
dua kelinci kacang sukro,1
dua kelinci kacang sukro bbq,1
dua kelinci kacang sukro bersalut kedele,1
dua kelinci kacang sukro kribo,1
dua kelinci kacang sukro oven bawang,1
dua kelinci snack campur tic tac mix,1
dua kelinci snack krip krip banana crunch,1
dua kelinci snack pilus tic tac sapi panggang,1
earl grey hot cup ,1
earl grey ice cup ,1
elvan truffle chocolate assortment,1
es loreng ,1
espe larutan penyegar orange,1
espe larutan penyegar strawberry,1
espresso candy centerfilled kopi susu,1
espresso frappe cup ,1
espresso kitkat frappe ,1
eternalplus mineral water,1
ever delicious butter cookies,1
ever delicious cookies cheese,1
ever delicious cream fillings cookies chocolate,1
ever delicious yam cookies taro,1
fanta soft drink orange,1
fanta soft drink strawberry,1
finna kerupuk seleraku bawang,1
finna kerupuk seleraku udang,1
fiorella chocolate wafer dark chocolate,1
fiorella chocolate wafer hazelnut,1
fishermans candy extra strong putih,1
fishermans candy lemon,1
fishermans candy strong mint hijau,1
fishermans candy sugar free blackcurrant,1
fishermans candy sugar free choco mint,1
fishermans candy sugar free choco orange,1
fishermans candy sugar free honey lemon,1
fishermans candy sugar free spearmint,1
flat white hot ,1
floridina juice pulp coco bit,1
floridina juice pulp orange,1
foxs candy coffee passionate blend,1
foxs candy crystal clear berries,1
foxs candy crystal clear himalayan salt lemon mints,1
foxs candy fruits,1
foxs candy fruity mints,1
foxs candy ice mints blackcurrant,1
foxs candy oval heritage tamarind ginger,1
foxs candy stick berries,1
foxs candy stick fruit,1
frestea minuman teh apel,1
frestea minuman teh aroma melati,1
frestea minuman teh green madu,1
frestea minuman teh melati,1
frestea minuman teh nusantara,1
frisian flag susu cair junio cokelat,1
frisian flag susu cair junio strawberry,1
frisian flag susu cair low fat cokelat,1
frisian flag susu cair low fat strawberry,1
frisian flag susu cair low fat vanilla,1
frisian flag susu cair uht coconut delight,1
frisian flag susu cair uht cokelat,1
frisian flag susu cair uht full cream,1
frisian flag susu cair uht ketan hitam,1
frisian flag susu cair uht low fat,1
frisian flag susu cair uht milky choco,1
frisian flag susu cair uht milky strawberry,1
frisian flag susu cair uht strawberry,1
frisian flag susu cair uht sweet delight,1
frisian flag susu sereal cair uht cokelat,1
frozz candy barley mint,1
frozz candy blueberry mint,1
frozz candy cherry mint,1
frozz candy cool mint,1
frozz candy lemon mint,1
fruit candy happy toy,1
fruitamin minuman coco bit lychee,1
fruitamin minuman coco bit splash coco,1
fruitamin minuman coco bit splash guava,1
fruitamin minuman coco bit splash mango,1
gambino coffee rebels cold brew scottish cream,1
gambino coffee rebels cold brew swiss hazelnut,1
gambino coffee rebels tea latte matcha tea,1
garuda kacang atom,1
garuda kacang atom apc pedas,1
garuda kacang garing,1
garuda kacang panggang rosta bawang,1
garuda kacang panggang rosta jagung bakar,1
garuda kacang panggang rosta pedas,1
garuda kacang panggang rosta wagyu,1
garuda kacang telur,1
garuda snack ocorn jagung bakar,1
garuda snack ocorn sea salt,1
garuda snack pilus mi goreng,1
garuda snack pilus rendang,1
garuda snack potato crunchy bee daging sapi bbq,1
garuda snack potato crunchy bee sambal geprek,1
garuda snack potato crunchy net potato bbq,1
garuda snack potato daging sapi bbq,1
garuda snack potato kentang eropa,1
gery butter cookies,1
gery crackers malkist saluut coconut,1
gery crackers malkist saluut coklat,1
gery crackers malkist saluut coklat coconut,1
gery crackers malkist saluut double abon,1
gery crackers malkist saluut keju,1
gery kraker beras asin,1
gery snack sereal,1
gery wafer egg roll,1
gery wafer roll chocolatos dark,1
gery wafer saluut mabar choco coconut,1
gingerbon permen jahe,1
gingerbon permen jahe peanut butter,1
glico biscuit pejoy chocolate,1
glico biscuit pejoy cookies cream,1
glico biscuit pocky choco banana,1
glico biscuit pocky chocolate 47g box,1
glico biscuit pocky cookies cream,1
glico biscuit pocky double choco,1
glico biscuit pocky matcha,1
glico biscuit pocky strawberry,1
glico biscuit pocky yuzu,1
glico biscuit stik pretz bbq chicken,1
glico biscuit stik pretz original,1
go fress refreshing oral care strips 24 grape,1
go fress refreshing oral care strips 24 peppermint,1
go fress refreshing oral care strips 24 strawberry,1
golda coffee drink cappuccino,1
golda coffee drink dolce latte,1
golden nut frappe ,1
good day coffee drink avocado delight,1
good day coffee drink cappuccino,1
good day coffee drink funtasic mocacinno,1
good day coffee drink tiramisu bliss,1
good family biscuit assorted,1
good mood minuman ekstrak buah blackcurrant,1
good mood minuman ekstrak buah lemon madu,1
good mood minuman ekstrak buah stroberi,1
good time cookies chocochips classic,1
good time cookies chocochips double choc,1
good time cookies coffee,1
green sands original lime apple,1
green sands soft drink lemon grape,1
greenday for kids crispy broccoli,1
greenday for kids crispy strawberry,1
greenfields fresh milk pasteurisasi full cream,1
greenfields fresh milk pasteurisasi low fat,1
greenfields uht milk choco malt,1
greenfields uht milk full cream,1
greenfields uht milk low fat,1
greenfields uht milk skimmed,1
greenfields uht milk strawberry,1
guribee snack bbq balado,1
guribee snack rumput laut,1
hampton chocolate chip cookies,1
hampton double chocolate cookies,1
hampton shortbread pure butter chocolate,1
hampton shortbread pure butter clasic,1
hampton wholesome oatmeal cookies,1
happy pop snack popriginal,1
happy pop snack seaweed,1
happydent chewing gum cool mint,1
happydent chewing gum wave strawberry,1
happydent white chewing gum,1
happydent white chewing gum mint,1
happytos snack tortila chips hijau,1
happytos snack tortila chips merah,1
happytos snack tortilla chips hot chili,1
happytos snack tortilla chips jagung bakar,1
happytos snack tortilla chips nacho cheese,1
happytos snack tortilla chips roasted corn,1
haribo candy gummy gold bears,1
haribo candy gummy happy cola zour,1
haribo candy gummy peaches,1
haribo candy gummy starmix,1
haribo candy gummy worms,1
haribo chamallows pink white,1
hatari crackers see hong puff sugar,1
hatari jam biscuit peanut,1
heavenly blush yogurt strawberry,1
hemaviton energi drink,1
hemaviton health drink c1000 collagen orange,1
hemaviton health drink vitamin c1000 orange,1
hemaviton vitamin c1000 lemon,1
hemaviton vitamin c1000 less sugar orange,1
hexos candy lemon mint,1
hexos candy mint,1
hi c1000 health drink vitamin lemon,1
hi c1000 health drink vitamin orange,1
hilo school susu cair uht chocolate,1
hilo school susu cair uht vanila vegiberi,1
hilo susu cair uht chocolate taro,1
hilo teen susu cair uht chocolate,1
himalaya salt mint candy lemon,1
homesoy soya milk drink no sugar added,1
homesoy soya milk drink original,1
hydro coco natural health drink,1
hydro coco natural health drink vita d,1
ice shaken blackpeach ,1
ice shaken creamy latte ,1
ichi ocha minuman green tea,1
ichi ocha minuman teh madu lemon,1
ichi ocha minuman teh melati,1
ichitan cold brew coffee brown sugar,1
ichitan cold brew coffee classic latte,1
ichitan thai milk green tea drink,1
ichitan thai milk tea drink,1
inaco jelly mini,1
inaco mini jelly mix flavour,1
indofood syrup freiss cocopandan,1
indofood syrup freiss melon,1
indofood syrup freiss orange,1
indomaret air mineral,1
indomaret air minum,1
indomaret air minum dengan oksigen doraemon,1
indomaret air minum dengan oksigen sporty,1
indomaret air minum ph tinggi 8,1
indomaret air oksi galon isi ulang,1
indomaret almond milk chocolate,1
indomaret biscuit milk chocolate,1
indomaret blueberry dark chocolate,1
indomaret candy gummy,1
indomaret cashew milk chocolate,1
indomaret coconut water,1
indomaret cream crackers,1
indomaret crispy seaweed barbeque,1
indomaret crispy seaweed original,1
indomaret dehydrated fruit mangga,1
indomaret emping jagung,1
indomaret emping udang,1
indomaret freeze dried milk chocolate strawberry,1
indomaret galon isi oksi,1
indomaret gummy choco mix fruits,1
indomaret kacang almond,1
indomaret kacang almond lapis madu,1
indomaret kacang asin panggang,1
indomaret kacang bali,1
indomaret kacang bumbu,1
indomaret kacang jumbo,1
indomaret kacang koro kulit,1
indomaret kacang koro original,1
indomaret kacang kriuk,1
indomaret kacang kulit,1
indomaret kacang mete madu,1
indomaret kacang mete pedas,1
indomaret kemplang bulat,1
indomaret kemplang mini,1
indomaret keripik buah apel,1
indomaret keripik buah nangka,1
indomaret keripik buah salak,1
indomaret keripik pisang madu,1
indomaret keripik singkong asin,1
indomaret keripik singkong tradisional,1
indomaret keripik tempe,1
indomaret kerupuk bawang,1
indomaret kerupuk slondok udang,1
indomaret kuaci,1
indomaret kuaci susu,1
indomaret malkist crackers,1
indomaret milk chocolate hazelnut,1
indomaret milk chocolate raisin,1
indomaret mini bagelen cokelat,1
indomaret mini bagelen keju,1
indomaret minuman lemon tea,1
indomaret minuman teh apel,1
indomaret minuman teh hijau melati,1
indomaret mix nuts,1
indomaret otak otak ikan tenggiri,1
indomaret pop corn,1
indomaret popcorn caramel,1
indomaret popcorn sweet cheese,1
indomaret rengginang,1
indomaret snack emping manis pedas,1
indomaret snack kacang atom  shanghai,1
indomaret snack kacang atom pedas,1
indomaret snack kacang panggang,1
indomaret snack kacang polong tepung,1
indomaret snack kacang telur medan,1
indomaret snack kuku macan,1
indomaret snack pang pang,1
indomaret snack samosa,1
indomaret snack soes cokelat,1
indomaret snack stick keju,1
indomaret tempura seaweed,1
indomaret wafer stick,1
indomilk susu cair banana fruit,1
indomilk susu cair botol chocolate,1
indomilk susu cair botol melon,1
indomilk susu cair botol strawberry,1
indomilk susu cair chocolate,1
indomilk susu cair uht banana,1
indomilk susu cair uht belgian choco,1
indomilk susu cair uht chocolate,1
indomilk susu cair uht chocolate java criollo,1
indomilk susu cair uht cokelat,1
indomilk susu cair uht italian coffee latte,1
indomilk susu cair uht kids cokelat,1
indomilk susu cair uht kids less sugar cokelat,1
indomilk susu cair uht kids strawberry,1
indomilk susu cair uht kids vanilla,1
indomilk susu cair uht korean banana,1
indomilk susu cair uht korean black latte,1
indomilk susu cair uht korean pink blossom,1
indomilk susu cair uht plain,1
indomilk susu cair uht strawberry,1
indomilk susu cair uht vanilla,1
indomilk susu steril honey,1
indomilk susu steril plain,1
inkubisc ria rio biscuit cream vanilla,1
isoplus minuman isotonik,1
isoplus minuman isotonik coco,1
jae jae permen jahe,1
japota potato chips happy honey butter,1
japota potato chips sambal bawang,1
japota potato chips umami japanese seaweed,1
javana minuman teh melati,1
javana minuman teh melati gula batu,1
jele minuman collagen,1
jetz snack stick chocofiesta,1
jlo fizzlepop lollipop candy doraemon,1
jlo fizzlepop lollipop candy my little pony,1
julies sandwich choco more,1
julies sandwich peanut butter,1
kacang bawang oven,1
kacang polong pedas,1
kaki tiga larutan penyegar anak strawberry,1
kaki tiga larutan penyegar jambu biji,1
kaki tiga larutan penyegar jeruk nipis,1
kaki tiga larutan penyegar leci,1
kaki tiga larutan penyegar putih,1
kalpa chocolate twin coklat kelapa,1
kalpa wafer share it cokelat kelapa,1
kanzler singles bakso keju,1
kanzler singles bakso original,1
kapal api coffee drink signature orginal black coffee,1
kapal api coffee drink signature strong black coffee,1
kapal api coffee drink white coffee,1
kartika toast almond cookies,1
kartika toast bagelan butter,1
kartika toast bagelan cheese,1
kartika toast soes snack cream cheese,1
kartika toast soesnack chocolate,1
karuhun keripik singkong original,1
karuhun keripik singkong original sp,1
kata oma snack telur gabus balado padang,1
kata oma snack telur gabus gula aren,1
kata oma snack telur gabus keju,1
kata oma snack telur gabus telur asin,1
khong guan biscuit mini assorted,1
khong guan biscuit red assorted,1
khong guan biscuit red segi assorted,1
khong guan chocolate wafer classic,1
khong guan crackers wafer saltcheese combo,1
khong guan crackers cream,1
khong guan crackers malkist,1
khong guan crackers malkist abon sapi,1
khong guan crackers malkist kelapa,1
khong guan crackers malkist superco,1
khong guan crackers potatoz,1
khong guan crackers salt pepper,1
khong guan crackers saltcheese barbeque,1
khong guan crackers saltcheese combociz,1
khong guan crackers saltcheese regular,1
khong guan crackers saltcheese sweet spicy,1
khong guan crackers sugar puff,1
khong guan crackerswafer saltcheese combo,1
khong guan gabin crackers salut chocolate,1
khong guan marie salut cokelat,1
khong guan original crackers saltines,1
khong guan saltines crackers vegetables,1
khong guan wafer stick chocolate,1
kin sterilized milk plain,1
kinder joy chocolate crispy boys,1
kinder joy chocolate crispy girl,1
kinder joy chocolate crispy natoons,1
kiranti jamu pegal linu,1
kiranti juice sehat datang bulan orange,1
kiranti sehat datang bulan,1
kis candy mint grape,1
kis himalaya salt candy cool mint cherry,1
kis himalaya salt candy cool mint lime,1
kis himalaya salt candy cool mint peppermint,1
kit kat chocolate 2 fingers multipack,1
kit kat chocolate 2 fingers single,1
kit kat chocolate 4 fingers,1
kit kat chocolate 4 fingers gold,1
kit kat chocolate 4 fingers multipack,1
kit kat chocolate chunky,1
kit kat chocolate chunky raisin cookie,1
kiwi pandan iced ,1
kokola kukis butter,1
kokola kukis vanila,1
kokola wafer roll chocolate,1
kopi kenangan hanya untukmu coffee drink avocuddle,1
kopi kenangan hanya untukmu coffee drink black aren,1
kopi kenangan hanya untukmu coffee drink mantancino,1
kopi pandan iced ,1
kopi saku vanilla latte,1
kopi susu jahe  cup,1
kopibaper choco berry,1
kopibaper cold brew black,1
kopibaper cold brew caramel,1
kopibaper cold brew original,1
kopibaper cold brew palm sugar,1
kopibaper earl grey milk tea,1
kopibaper espresso caramel,1
kopibaper espresso kopi jadul,1
kopibaper espresso original,1
kopibaper espresso palm sugar,1
kopiko candy coffee blister,1
kopiko coffee candy,1
kopiko coffee latte 78c,1
kopiko minuman kopi susu lucky day,1
kopiko sugar free coffee candy,1
kraft sandwich oreo birthday sprinkles,1
kraft sandwich oreo blackpink cokelat hitam,1
kraft sandwich oreo chocolate creme,1
kraft sandwich oreo ice cream blueberry,1
kraft sandwich oreo original,1
kraft sandwich oreo strawbery creme,1
krakakoa bark dark milk chocolate baguette,1
krakakoa bark milk chocolate seed grain sourdough,1
kratingdaeng energy drink reguler,1
kratingdaeng energy drink super,1
krisbee snack french fries,1
krisbee snack pillow choco lava,1
krisma food cheese butter cookies,1
krisma food chicken floss egg roll,1
krisma food chocolate butter cookies,1
krisma food durian kuih kapit,1
krisma food fish skin salted egg,1
krisma food puffs coffee,1
krisma food puffs vanilla,1
krisma food rendang beef floss egg roll,1
krisma food sambal shrimp egg roll,1
krisma food sesame singaporean kuih kapit,1
krisma food singaporean kuih kapit,1
kunyit jahe  cup,1
kunyit jahe  cup,1
kurma oat frappe ,1
kusuka keripik emping original,1
kusuka keripik singkong ayam lada hitam,1
kusuka keripik singkong balado,1
kusuka keripik singkong barbeque,1
kusuka keripik singkong ghost pepper,1
kusuka keripik singkong keju bakar,1
kusuka keripik singkong original,1
kusuka keripik singkong rumput laut,1
kusuka keripik singkong saos balado,1
lactasoy drink soy milk chocolate,1
lactasoy drink soy milk collagen,1
lactasoy drink soy milk original clasic,1
ladang lima cookies blackmond,1
ladang lima cookies blackthins,1
ladang lima cookies pumpberry,1
ladang lima macaroni cheese cassava pasta,1
lagie chocolate alpine full milk,1
lagie chocolate golden city,1
lagie chocolate peanut pie,1
lagie milk chocolate cashew nut,1
lago wafer cacao,1
lasegar twist jeruk lemon,1
lasegar twist lemon,1
laverland crunch seaweed strips rice pop,1
laverland crunch snack fish seaweed original,1
laverland crunch snack seaweed habanero,1
laverland crunch snack seaweed sea salt,1
laverland crunch snack seaweed sweet soy,1
laverland crunch snack seaweed wasabi,1
lazery candy jumbo assorted,1
le minerale air mineral,1
lemon tea hot ,1
lemon tea iced ,1
lemonia minuman sari lemon,1
lemonilo cassamo keripik singkong smoky bbq,1
lemonilo cassamo keripik singkong spicy bbq,1
lemonilo chimi keripik ubi jagung bakar,1
lemonilo chimi keripik ubi jagung balado,1
lidi geli snack mie lidi bbq,1
lidi geli snack mie lidi spicy,1
l men susu cair whey protein 2 go chocolate,1
loacker wafer cream kakao,1
loacker wafer napolitaner,1
loacker wafer quadratini chocolate,1
loacker wafer quadratini napolitaner,1
long black hot ,1
long black iced ,1
lotte bubble gum barbie fantasia grape,1
lotte chewing gum sugar free xylitol blueberry mint,1
lotte chewing gum sugar free xylitol fresh mint,1
lotte chewing gum sugar free xylitol jeruk nipis mint,1
lotte choco pie marsmallow,1
lotte choco pie marsmallow,1
lotte choco pie marsmallow cheese,1
lotte minuman bersoda milkis,1
lovy butter cookies choco butter,1
lovy butter cookies coffeeccino,1
luwak coffee drink kopi gula,1
luwak white koffie original,1
macito snack keju jagung bakar,1
madu nusantara honeymon drink,1
magic spicy cracker sambal matah,1
maira crispy macaron,1
mamasuka rumput laut panggang nori,1
mamasuka rumput laut panggang nori jagung bakar,1
mamasuka rumput laut panggang nori pedas,1
mamasuka rumput laut panggang nori salted egg,1
mamasuka rumput laut panggang nori sapi panggang korea,1
mamee monster snack mi bbq,1
mamee monster snack mi chicken,1
manjun snack seaweed corn oil,1
manjun snack seaweed olive oil,1
marjan syrup cocopandan,1
marjan syrup melon,1
master kim snack potato stick honey butter,1
master kim snack potato stick hot spicy,1
master kim snack potato stick salted,1
matcha frappe ,1
matcha hot ,1
matcha iced ,1
maxicorn snack barbecue,1
maxicorn snack nacho cheese,1
maxicorn snack roasted corn,1
mayasi kacang koro pok pok,1
mayasi kuaci bawang,1
mayasi kuaci milk,1
meiji biscuit hello panda cheese cream,1
meiji biscuit hello panda chocolate,1
meiji biscuit hello panda cookies and cream,1
meiji biscuit hello panda strawberry,1
meiji biscuit yan yan chocolate,1
meiji biskuit yan yan chocolate,1
meiji biskuit yan yan strawberry,1
meiji plain crackers,1
meiji plain crackers with oat,1
mentos candy chewy dragees roll anggur,1
mentos candy fruit,1
mentos candy lets party fruit punch,1
mentos candy mint,1
mentos candy mix minis,1
mentos candy peach orange,1
mentos candy rainbow,1
mentos incredible chew candy grape,1
mi gemez snack mie kering enaak premium,1
mi gemez snack mie kering enak fam pack spicy,1
milk life fresh milk choco,1
milk life fresh milk low lactose,1
milk life fresh milk pure,1
milk life susu cair uht chocolate,1
milk life susu cair uht strawberry,1
milkido susu cokelat,1
milkita candy,1
milku susu uht cokelat premium,1
milku susu uht stroberi,1
milo activ go high calcium kaleng,1
milo activ go original kaleng,1
milo activ go uht susu cokelat,1
milo choco bar,1
milo chocolate nuggets,1
milo sereal bar cokelat,1
mini oreo biskuit coklat,1
mini oreo biskuit strawberry,1
mini oreo biskuit vanilla,1
mintz candy black mint,1
mintz candy chewy mints double mint,1
mintz candy chewy mints peppermint,1
minute maid juice pulpy orange,1
mister potato snack crisps barbeque,1
mister potato snack crisps ghost pepper,1
mister potato snack crisps ghost pepper cheese,1
mister potato snack crisps ghost pepper seaweed,1
mister potato snack crisps honey cheese,1
mister potato snack crisps original,1
mister potato snack crisps roasted beef,1
mister potato snack crisps sambal matah,1
mixed fruit oolong hot cup ,1
mixed fruit oolong ice cup ,1
mizone active minuman isotonik lychee lemon,1
mizone mood up minuman isotonik cranberry,1
mocha frappe cup ,1
mogu mogu jelly with nata de coco lychee,1
mogu mogu jelly with nata de coco strawberry,1
mogu mogu minuman nata de coco coconut,1
mogu mogu minuman nata de coco grape,1
mogu mogu minuman nata de coco lychee,1
mogu mogu minuman nata de coco mangga,1
mogu mogu minuman nata de coco nanas,1
mogu mogu minuman nata de coco sirsak,1
mogu moguminuman nata de coco strawberry,1
monde biscuit butter cookies,1
monde biscuit egg drops,1
monde biscuit fried cookies,1
monde biscuit genji pie,1
monde biscuit genji soft pie cokelat,1
monde biscuit piebis,1
monde biscuit serena snack gold,1
monde biscuit soft pie strawberi,1
monde biskuit bourbon cokelat,1
monde boromon cookies original,1
monde butter cookies,1
monde cookies serena egg roll,1
monde cookies serena egg roll chocolate,1
monde cookies serena egg roll original,1
monde couque dasse chocolate,1
monde crackers cream,1
monde phoenix roll,1
monde pola snack,1
monde selected biscuit,1
monde snack spicy tomato,1
morinaga minuman susu steril chil go coklat,1
morinaga minuman susu steril chil go melon madu,1
morinaga minuman susu steril chil go strawberry,1
morinaga minuman susu steril chil go vanilla,1
morisca lapis legit singkong batang srikaya,1
mr.bread roti kasur,1
mr.bread roti manis isi coklat keju,1
mr.bread roti manis sobek keju,1
mr.bread roti tawar gandum multiseed,1
mr.bread roti tawar kupas,1
mr.hottest maitatos snack potato chips chili balado,1
mr.hottest maitatos snack potato chips korean bbq,1
mr.hottest snack tortilla chips maitos jagung barbeque,1
mr.hottest snack tortilla chips maitos sambal balado,1
mr.natta minuman nata de coco jelly blueberry,1
mr.natta minuman nata de coco jelly leci,1
mr.p kacang madu,1
mujigae susu cair banana,1
mujigae susu cair choco banana,1
mujigae susu cair strawberry banana,1
munchys salted choco sandwich lexus chocolate cream,1
munchys salted choco sandwich lexus vanilla cream,1
munchys sandwich calcium cracker lexus cheese cream,1
muria makaroni snack pedas,1
muria marning jagung pedas,1
muria seblak stick cabe merah,1
muria snack basreng,1
muria snack kacang kedelai,1
muria telur ikan,1
my tea minuman teh oolong,1
nabati richeese wafer krim keju,1
nabati richoco wafer chocolate,1
nabati richoco wafer white,1
nabati siip snack bite size cheese,1
nabati siip snack bite size cokelat,1
nabati siip snack bite size jagung bakar,1
nabati vitakrim wafer raspberry yoghurt,1
nadesha snack kue gambang,1
nambo seaweed rice crisps original,1
nambo seaweed rice crisps spicy,1
nambo seaweed rice crisps truffle,1
nambo seaweed rice crisps wasabi,1
nano nano candy milky coklat,1
nano nano candy milky strawberry,1
nano nano candy rame,1
naraya butter ring cookies,1
naraya fish chocolate,1
naraya kuaci kakopi,1
naraya kuaci rempah,1
naraya kuaci spiced,1
naraya oat choco,1
naraya oat choco chocolate,1
naraya oat cookies,1
naraya orange candy,1
naraya richy rice crackers,1
naraya richy snow crackers,1
naraya soya botol kedelai,1
neo hormoviton energi drink,1
nescafe coffee cream,1
nescafe coffee drink cappuccino,1
nescafe coffee drink caramel macchiato,1
nescafe coffee drink ice black,1
nescafe coffee drink latte,1
nescafe coffee latte drink eclair,1
nescafe ice coffee latte,1
nescafe ice coffee mocha,1
nescafe ice coffee original,1
nestle air mineral pure life,1
nestle dancow fortigro susu uht anak rasa cokelat,1
nestle dancow fortigro susu uht anak rasa stroberi,1
nestle dancow fortigro susu uht anak rasa vanila,1
nestle goodnes susu cair kurma royale,1
nestle koko krunch cereal bar coklat,1
nextar blueberry cookies,1
nextar choco brownies,1
nextar nastar cookies brownies,1
nextar nastar cookies pineapple,1
nextar noir chocolate,1
nextar strawberry cookies,1
nissin biscuit butter coconut,1
nissin biscuit coffee milk,1
nissin biscuit gabin,1
nissin biscuit gabin keju,1
nissin biscuit kelapa ijo,1
nissin cookies lemonia,1
nissin cookies sagu keju,1
nissin crackers crispy,1
nissin golden wafer chocolate,1
nissin longer stick biscuit,1
nissin vegetable crackers,1
nissin wafer chocolate,1
nissin wafer cream dapur cokelat choco lava,1
nissin wafer ovaltine chocolate malt,1
nissin walens blueberry soes pck,1
nissin walens cheese soes,1
nissin walens choco soes,1
nola gluten free cookies caramelize strawberry,1
nola gluten free cookies choco chips,1
nola gluten free cookies dark chocolate,1
nong shim onion ring,1
nong shim shrimp cracker,1
nong shim shrimp cracker hot spicy,1
nong shim snack banana kick,1
nong shim snack chochung u gua,1
nong shim snack honey twist,1
nong shim snack potato,1
nong shim snack shrimp chips,1
nong shim snack tako chips,1
nu minuman green tea honey,1
nu minuman green tea original,1
nu minuman milk tea,1
nu minuman teh tarik,1
nu minuman yogurt tea,1
nutella b ready ferrero,1
nutriboost mango,1
nutriboost orange,1
nutriboost strawberry,1
nutrive minuman benecol blackcurrant,1
nutrive minuman benecol lychhe,1
nutrive minuman benecol orange,1
nutrive minuman benecol strawberry,1
nutriville collagen drink grape,1
nutty chocofee frappe ,1
oatbits biskuit oat choco banana,1
oatbits biskuit oat raisin kismis,1
oatbits biskuit oat strawbery yogurt,1
oatbits biskuit oat vitafruit,1
oatbits oat8 biscuit havermout almond,1
