nama,klasifikasi
ponds vitamin micellar water brghtening rose,2
ponds vitamin micellar water brghtening rose,2
ponds white beauty serum burst cream,2
ponds white beauty skin perfecting cream for normal skin,2
purbasari matte powder hydra series honey beige,2
purbasari matte powder hydra series natural,2
rabbit habit active collagen essential mask,2
rabbit habit calming treatment mask,2
revlon matte balm lipcolor 225 sultry,2
revlon ultra hd matte lipcolor 600 devotion,2
rexona deo dry serum natural brightening fresh sakura,2
rojukiss bright pore expert 5x mask,2
rojukiss jeju lotus serum cleanser glow bright,2
rojukiss pinkish bright serum jeju lotus,2
rojukiss pro acne serum cleanser tea tree bija,2
rojukiss pro acne serum tea tree bija,2
safi age defy gold water essence,2
safi illuminating day cream spf 20 pa,2
safi white expert purifying cleanser,2
sari ayu facial foam anti acne,2
sari ayu facial foam gel hydra glow,2
sari ayu facial foam putih langsat,2
sari ayu foundation kuning langsat,2
sari ayu foundation kunng pengantin,2
sari ayu intensive acne serum,2
sari ayu loose powder kuning langsat,2
sari ayu loose powder kuning pengantin,2
sari ayu pelembab mawar normal kering,2
sari ayu pelembap moisturizer putih langsat,2
sari ayu penyegar refreshing aromatic jeruk,2
sari ayu penyegar refreshing aromatic mawar,2
selection kapas kecantikan,2
selection kapas special tipis,2
selection round kapas,2
senka perfect whip acne care,2
st.ives fresh skin apricot scrub,2
vaseline lip therapy aloe vera,2
verile acne gel,2
vienna blackhead remover 3 steps nose,2
vienna face spa peel off mask clarifying egg,2
vienna relaxing sleeping face mask good night,2
viva eye brow pencil hitam,2
viva eye brow pencil q c brown,2
viva milk cleanser bengkoang,2
wardah acnederm pure foaming cleanser,2
wardah creamy wash c defense,2
wardah essence sheet mask lightening,2
wardah everyday bb cream natural,2
wardah everyday lip balm fruity sheer grape,2
wardah everyday lip balm fruity sheer strawberry,2
wardah excluisve matte lip cream 08pink credible,2
wardah excluisve matte lip cream 09 mauve on,2
wardah eyebrow pencil brown,2
wardah eyeliner pencil black,2
wardah eyexpert matic brow definer 02 dark brown,2
wardah lightening bb cream light,2
wardah lightening feel two way cake 02 golden beige,2
wardah lightening feel two way cake 03 sheer pink,2
wardah lightening liquid foundation 02 beige,2
wardah lightening liquid foundation 03 ivory,2
wardah lightening serum ampoule,2
wardah lightening two way cake refill 02 golden beige,2
wardah lightening two way cake refill 03 sheer pink,2
wardah lightening whip facial foam,2
wardah perfect bright cooling bright jelly facial foam,2
wardah perfect bright creamy foam bright oil control,2
wardah perfect bright creamy foam bright smooth glow,2
wardah perfect bright moisturizer bright oil control spf 30 pa,2
wardah renew you anti aging facial wash,2
wardah renew you spf 35 pa day cream,2
wardah tone up micellar water perfect bright,2
wardah ultralight matte lipstick 01 parfait pink,2
wardah ultralight matte lipstick 05 blossom pink,2
wardah ultralight matte lipstick 08 woodsy brown,2
wardah whitecrystal secret facial wash,2
y.o.u hy! amino ac ttack anti acne facial wash,2
y.o.u hy! amino control oil facial wash,2
y.o.u mate face mask camelia pome,2
y.o.u mate face mask margold avocado,2
y.o.u mate face mask rose honey,2
y.o.u supreme matte 04 coco,2
y.o.u dual eyebrow styler 03 dark brown pcs,2
madame gie eyeshadow moondust temptatiton 05,2
abstract eyelash f5 bohemian,2
abstract eyelash n4 iris,2
azarine calm my acne sunscreen moisturiser spf 35 pa,2
azarine hydrasoothe sunscreen gel spf 45 pa,2
azzura compact powder 01 light beige,2
beautyline express remover,2
emina bare with me mineral loose powder 01 fair,2
emina bare with me mineral loose powder 04 ebony,2
emina cheek lit blush stick nudetwinkle,2
emina cheek lit blush stick peach,2
emina cheek lit blush stick pink,2
emina cheek lit cream blush pink,2
emina cheek lit highlighter powder nudesparkle,2
emina glossy stain 04 peach sprinkles,2
emina glossy stain 05 spring dazzle,2
emina magic potion lip tint 04 sienna,2
emina magic potion lip tint 06 sassy,2
emina micellar water drop cleanser bright stuff,2
emina skin buddy bubble up face wash,2
emina skin buddy face toner,2
emina sugar rush lipstick carrot cake,2
emina sugar rush lipstick peach pancake,2
garnier men acne fighting kit,2
ginza acne care face serum,2
ginza glow up brightening face serum,2
glow lovely 2 in 1 powder cream,2
himalaya brightening face wash herbals clear complex,2
himalaya lip balm,2
implora cheek lip tint 01 vampire blood,2
implora cheek lip tint 02 cherry bomb,2
implora dawn eyeshadow palette,2
implora deep black mascara,2
implora eye brow pencil 002 brown,2
implora eyeliner pen black,2
implora intense matte lipstick 01 cherry crush,2
implora intense matte lipstick 02 maple mocha,2
implora intense matte lipstick 04 dirty peach,2
implora midnight serum,2
indomaret nail clipper,2
kao biore makeup remover cleansing water soften up,2
kao biore pore pack cleansing strips citrus crush,2
kepik blush on brush,2
kepik eyelashes,2
kepik make up blender,2
kepik make up brush set,2
kepik penjepit bulu mata,2
kojiesan facial wash skin lightening hydromoist,2
loreal pro youth face mask lifting essence,2
loreal revitalift crystal gel cream,2
madame gie always on 01,2
madame gie always on 02,2
madame gie always on 03,2
madame gie always on 04,2
madame gie always on 05,2
madame gie beauty mud icing mask bamboo charcoal,2
madame gie beauty mud icing mask dead sea,2
madame gie beauty mud icing mask glacier,2
madame gie beauty mud icing mask kaolin earth,2
madame gie eyeshadow moondust temptatiton 06,2
madame gie gorgeous wink celebs pretty thick,2
madame gie madame perfect brow 01 gold grey,2
madame gie madame perfect brow 02 lovely brown,2
madame gie magnifique lip crayon satin 503,2
madame gie magnifique lip crayon satin 504,2
madame gie magnifique lip crayon satin 505,2
madame gie magnifique lip crayon satin 506,2
madame gie magnifique lip crayon satin 508,2
madame gie magnifique lip liquide matte 407,2
madame gie magnifique lip liquide matte 408,2
madame gie magnifique lip liquide matte 409,2
madame gie silhouette eyeliner 48 jam 10 midnight black,2
madame gie sweet cheek blush on 01,2
madame gie sweet cheek blush on 02,2
make over blush on single 10 passion pink,2
make over brow styler eye definer americano,2
make over cliquematte lip stylo 202 hollywood,2
make over cliquematte lip stylo 205 jetsetter,2
make over eye brow pencil black lines,2
make over eye liner pencil black jack,2
make over eye shadow palette nudes,2
make over hydra serum,2
make over hyperblack superstay liner,2
make over intense matte lip cream 004 vanity,2
make over intense matte lip cream 008 libertine,2
make over intense matte lip cream 011 pompous,2
make over intense matte lip cream 018 classic,2
make over perfect cover two way cake 03 maple,2
make over perfect cover two way cake 04 dessert,2
make over perfect cover two way cake 08 honey,2
make over power stay color correct power green,2
make over power stay demi matte cover cushion w22 warm ivory,2
make over silky smooth translucent powder 02 rosy,2
make over silky smooth translucent powder 07 vanilla,2
make over trivia eye shadow golden espress,2
make over trivia eye shadow indian summer,2
make over ultra cover liquid matt foundation 02 pink shade,2
make over ultra hi matte lipstik 005 champagne rose,2
make over ultra hi matte lipstik 012 envy,2
make over velvet mattifying primer,2
maybelline fit me fresh tint spf 50 03,2
maybelline fit me fresh tint spf 50 05,2
maybelline foundation fit me matteporels 120 classic ivo,2
maybelline line tattoo high impact liner make up remover,2
maybelline mascara hypercurl make up remover waterproof,2
maybelline mascara the colossal black waterproof,2
maybelline super stay ink crayon 90 keep it fun,2
maybelline super stay ink vinyl 60 mischievous,2
maybelline super stay ink vinyl 65 saucy,2
mustika ratu face cleanser toner face wash bengkoang,2
nivea micellair pearl bright,2
nivea sun extra protect face serum spf 50 instant aura,2
nivea sun extra protect face serum spf 50 oil control,2
pixy bb cream bright fix ochre,2
pixy color comm nail enamel p 03,2
pixy eye liner colors of delight brown,2
pixy eye shadow colors of delight romantic poem,2
pixy fresh toner brightening,2
pixy get inked! 01 pink pleasure,2
pixy get inked! 02 maroon madness,2
pixy get inked! 03 burgundy crush,2
pixy lip conditioner color of delight orange box,2
pixy loose powder uv whitening yellow beige,2
pixy matte in love lipstick 310 deep pulm,2
pixy radiant finish lightening cream complete barier,2
pixy two way cake uv whitening white cream,2
ponds age miracle day cream,2
ponds pelembab wajah day cream oily skin,2
ponds pelembab wajah day cream sun protection,2
ponds pembersih wajah anti bacterial,2
ponds pembersih wajah pure white,2
ponds sun serum uv protect spf35 pa uva uvb,2
ponds white beauty instabright tone up milk cream,2
purbasari alas bedak natural,2
purbasari glow facial foam brightening,2
purbasari hi matte lip cream 06 dahlia,2
purbasari hi matte lip cream 10 ayanna,2
purbasari hi matte lip cream 11 magnolia,2
purbasari lipstick color matte 87 zamrud,2
purbasari lipstick color matte 89,2
purbasari lipstick color matte 93,2
purbasari lipstick color matte 95,2
purbasari matte powder hydra series caramel,2
purbasari pembersih daily series bengkoang ketimun,2
purbasari ultra smooth brow liner 01 soft black,2
rabbit habit all in one face palette moongazing,2
rabbit habit all in one face palette over the moon,2
revlon colorstay combinationoily 220 natural beige,2
revlon colorstay normal  dry 240 medium beige,2
revlon double twist instant base top coat,2
revlon matte lipstick 003 mauve it over,2
revlon matte lipstick 004 retro red,2
revlon matte lipstick 016 paradise pink,2
revlon nail enamel 041 granite,2
revlon nail enamel 128 slate,2
revlon nail enamel 161 teak rose,2
revlon super lustrous lipstick 415 pink in the aft,2
revlon super lustrous lipstick 435 love that pink,2
safi age defy skin refiner,2
safi age defy youth elixir,2
safi cleanser toner oil control anti acne,2
safi white expert skin refiner,2
safi white expert ultimate essence,2
sari ayu pembersih white aromatic normal brminyak,2
scarlett acne day cream,2
scarlett acne night cream,2
scarlett acne serum,2
scarlett brightening facial wash,2
scarlett brightly ever after day cream,2
senka perfect whip berry bright,2
senka perfect white clay,2
somethinc 10% moisture sabi beet serum max brightening,2
somethinc 5% moisture sabi beet serum,2
somethinc acnedot treatment cleanser low ph,2
somethinc dark spot reducer ampoule,2
somethinc diamond phyto stem cell serum,2
somethinc game changer tripeptide eye concentrate gel,2
somethinc glow maker clarifying toner aha bha pha,2
somethinc low ph jelly cleanser,2
st.ives glowing sheet mask apricot,2
studio color peel off nail polish 08 beige,2
wardah acne face powder,2
wardah acne perfecting moisturizer gel spf 30,2
wardah blush on a,2
wardah blush on b,2
wardah blush on c,2
wardah c defense dd cream light,2
wardah c defense dd cream natural,2
wardah colorfit lip paint last all 00 jakarta,2
wardah colorfit lip paint last all 13 dubai lux,2
wardah colorfit velvet matte 02 joyful orange,2
wardah everyday bb cream light,2
wardah everyday cheek liptint 01 red set glow,2
wardah everyday cheek liptint 02 my berry,2
wardah excluisve matte lip cream 07 hello ruby,2
wardah excluisve matte lip cream 11 oh so nude,2
wardah exclusive creamy foundation 01 light beige,2
wardah exclusive creamy foundation 02 sheer pink,2
wardah exclusive liquid foundation 01 light beige,2
wardah exclusive liquid foundation 03 sandy beige,2
wardah exclusive matte lip cream 10 berry pretty,2
wardah exclusive matte lipstick 05 peach,2
wardah exclusive matte lipstick 16 summer pink,2
wardah exclusive matte lipstick 18 rosy pink,2
wardah exclusive moist lipstick 26 mango,2
wardah exclusive moist lipstick 36 sugary pink,2
wardah exclusive moist lipstick 46 chic magenta,2
wardah exclusive two way cake high coverage 01 sheer pink,2
wardah eye shadow a,2
wardah eye shadow g,2
wardah eye shadow i,2
wardah eye shadow l,2
wardah eye shadow m,2
wardah eyeshadow nude series classic,2
wardah eyexpert perfectcurl mascara,2
wardah instaperfect 3d brow mascara 01 brown,2
wardah instaperfect everlast matte liquid 04 grande,2
wardah instaperfect mattesetter lip mat 05 hype,2
wardah instaperfect mattetitude lipstik 02 noble,2
wardah instaperfect mattetitude lipstik 05 flux,2
wardah instaperfect powder foundation 13 beige,2
wardah instaperfect powder foundation rf 12 ivory,2
wardah instaperfect powder foundation rf 13 beige,2
wardah intense matte lipstick 02blushing nude,2
wardah lightening bb cake powder 03 natural,2
wardah lightening bb cake powder ref. 01 light,2
wardah lightening bb cake powder ref. 02 sheer pink 11g pcs,2
wardah lightening bb cake powder ref. 03 natural,2
wardah lightening bb cream natural,2
wardah lightening face mist spray,2
wardah lightening face toner,2
wardah lightening feel two wayc ref. 01 light beige,2
wardah lightening two way cake refill 05 beige,2
wardah lightening two way cake refill 06 ivory,2
wardah lightening two way cake refill 07 honey beige,2
wardah lightening two way cake spf 15 01 light beige,2
wardah lightening two way cake spf 15 04 natural,2
wardah lightening two way cake spf 15 05 beige,2
wardah lightening two way cake spf 15 06 ivory,2
wardah lightening two way cake spf 15 07 honey beige,2
wardah lightening two way cake spf 22 01 light beige,2
wardah lightening two way cake spf 22 04 natural,2
wardah lip palette chocoaholic,2
wardah lip palette perfect red,2
wardah lip palette pinky peach,2
wardah longlasting lipstick 03 simply brown,2
wardah longlasting lipstick 07 raspberry hip,2
wardah luminous face powder 01 light beige,2
wardah luminous face powder 02 beige,2
wardah luminous liquid foundation 03 beige,2
wardah luminous liquid foundation 04 natural,2
wardah luminous two way cake 02 beige,2
wardah luminous two way cake 03 ivory,2
wardah mineral clarifying clay mask,2
wardah moisture lip nutrition green tea,2
wardah moisture lip nutrition honey,2
wardah perfect glow cushion colorfit 23w warm ivory,2
wardah renew you anti aging day cream,2
wardah renew you anti aging intensive serum,2
wardah renew you anti aging night cream,2
wardah renew you treatment essence,2
wardah seaweed balancing facial scrub,2
wardah ultralight matte lipstick 03 caramel nude,2
wardah velvet matte lip mouse 01 brown dreamer,2
wardah velvet matte lip mouse 02 joyful orange,2
wardah velvet matte lip mouse 05 artisan mauve,2
wardah velvet matte lip mouse 07 red pioneer,2
wardah exclusive creamy foundation 04 natural,2
wardah lightening two way cake Spf 22 02 golden beige,2
wardah lightening two way cake Spf 22 03 sheer pink,2
wardah velvet matte lip mouse 04 pink sweetheart,2
white story acne soothing serum,2
white story brightening toner,2
white story peptide eye cream,2
y.o.u dual dramatic volume mascara,2
y.o.u rouge velvet matte lip cream 06 kelly,2
y.o.u rouge velvet matte lip cream 09 latte,2
garnier micellar rose water cleanse glow,2
nourish beauty care acne plast pink girl,2
dettol body wash onzen peach,2
giv sabun mandi red damask rose cherry blossom,2
giv sabun mandi white bengkoang yoghurt,2
nuvo sabun kesehatan family merah,2
dettol hand wash anti bakteri original,2
nuvo hand sanitizer anti bacterial fresh blossom,2
nuvo sabun kesehatan family cool,2
vaseline body lotion healthy bright uv extra bright,2
kojiesan skin lightening soap,2
nivea sun protect extra vitamin ce sun care spf 50,2
k natural white brightening body wash cotton flowers,2
k natural white brightening body wash aloe vera,2
k natural white brightening body wash cotton flower,2
k natural white brightening body wash sparkling magnolia,2
rexona deodorant roll on women invisible dry,2
posh deo roll on whitening,2
ariul hand cream tell me your wish cute,2
ariul hand essence tell me your wish happy,2
nivea deo roll on whitening hijab fresh,2
nivea sun face serum oil control spf 50,2
nivea extra white body serum hijab cooling,2
vivelle hand sanitizer aloe vera,2
purbasari lulur mandi whitening bangkoang,2
nivea deo roll on men deep,2
posh body spray perfumed black gold,2
posh body spray perfumed blaze pink,2
posh body spray perfumed cool blue,2
posh body spray perfumed fresh spirit,2
dettol instant hand sanitiser,2
nuvo hand sanitizer extra moisturizer fresh blossom,2
giv body wash flower berry,2
giv body wash glowing white mulberry collagen,2
sari ayu body scrub skin brightening putih langsat,2
eskulin cologne gel with moisturizer romantic day,2
skin aqua uv moisture milk spf 50,2
nuvo sabun kesehatan cair mild protect,2
fresh a hand soap anti bacterial,2
jf sabun mandi sulfur acne treatment,2
shinzui body cleanser skin lightening kirei,2
nuvo sabun kesehatan cair classic,2
nuvo sabun kesehatan cair nature,2
izzi body mist true love,2
izzi korean perfumed spray gyeonbok palace,2
kao biore body foam refill pure mild,2
natur e hand body lotion daily nourish revitalizing,2
dettol instant hand sanitizer,2
kao biore body foam guard jasmine,2
kao biore body foam guard lively refresh,2
dettol body wash anti bakteri cool,2
dettol body wash anti bakteri pump cool,2
dettol body wash onzen honey,2
dettol body wash pump fresh,2
dettol body wash pump original,2
herborist minyak zaitun,2
vitalis eau de naturel egyptian jasmine,2
fres natural fragrance mist hijab fresh cotton dreams,2
fres natural fragrance mist hijab fresh green mirage,2
kao biore body foam lively refresh btl,2
hanasui perfume body lotion uvauvb paris,2
kahf hair body wash energizing,2
kahf hair body wash relaxing,2
indomaret massage oil olive oil,2
kahf sunscreen moisturizer spf 30 pa,2
emeron hand body lotion lovely white pearl,2
home snow krim tumit kaki,2
herborist body serum refresh glow orange carrot,2
bagus antibacterial hand wash strawberry pch,2
herborist body serum hydrate glow raspberry tomato,2
instance hand sanitizer gel,2
sleek foamy hand wash soothing,2
cetaphil uvauvb defense spf 50uva,2
scarlett brightening shower scrub freshly,2
biodef natural protection body wash mint green tea,2
biodef natural protection body wash mint sea salt,2
kao biore body foam reffil whitening scrub,2
kao biore body foam refill cherry sakura,2
marina eau de toilette fresh sparkle,2
marina eau de toilette sweet romance,2
marina eau de toilette white diamond,2
gillette razor daisy plus for women,2
hanasui body spa exfoliating gel collagen blueberry,2
hanasui body spa exfoliating gel orange,2
mutouch shower cream goats milk green tea,2
mutouch shower cream goats milk pearl mulberry,2
mutouch shower cream goats milk royal jelly honey,2
dettol antiseptic germicide liquid,2
kao biore uv aqua rich watery essence,2
zen anti bacterial body soap shiso pure tea tree,2
mutouch shower cream goats milk wh s olive oil honey,2
evangeline eau de parfum black sakura,2
mutouch goats milk body lotion collagen vitamin e,2
mutouch goats milk body lotion habbatus sauda olive oil honey,2
mutouch goats milk body lotion pearl mulberry,2
mediheal aloe vera hydrogel,2
evangeline eau de parfum natural spray dream,2
evangeline eau de parfum natural spray evolve,2
fres natural fragrance mist bt21 persona blush,2
fres natural fragrance mist bt21 yellow in luv,2
evangeline eau de parfum rania,2
j 80 sanitizer,2
antis pembersih tangan antiseptik spray jasmine tea,2
antis pembersih tangan antiseptik spray jeruk nipis,2
antis pembersih tangan antiseptik spray timun,2
axe body spray deodorant ice chill,2
bigroot hand sanitizer spray organic,2
bigroot hand sanitizer spray sang pisang,2
braven eau de parfum black series platinum,2
carasun solar smart uv protection,2
carex hand spray anti bakteri,2
casablanca body mist cologne aqua,2
casablanca body mist cologne femme romantic,2
casablanca deodorant anti perspirant roll on romantic,2
cetaphil gentle skin cleanser face body,2
citra body lotion natural glowing white uv,2
citra body lotion nourishing white avocado honey,2
citra body lotion pearly white uv new,2
citra body lotion pearly white uv,2
citra hand body lotion sakura fair uv,2
citra pearly white uv tone up lotion,2
cussons imperial leather body mist marshmallow,2
dettol 2in1 sanitizer spray citrus tea,2
dettol body wash activ botany green tea bergamot,2
dettol body wash activ botany lavender chamomile,2
dettol body wash anti bakteri fresh,2
dettol sabun mandi anti bakteri cool,2
dettol sabun mandi anti bakteri fresh,2
dettol sabun mandi anti bakteri lasting fresh,2
dettol sabun mandi anti bakteri re energize,2
do re mi hair body wash moisturizing,2
dove body wash deeply nourishing,2
dove deeply nourishing body wash refill,2
dove deodorant roll on complete care original,2
dove deodorant roll on ultimate repair,2
dream whitening facial soap papaya,2
emina sun battle spf 30 pa,2
emina sun protection spf 30 pa,2
evangeline eau de parfum selection black vanilla,2
evangeline eau de parfum white musk,2
fres natural fragrance mist bt21 love yourself,2
fres natural fragrance mist hijab fresh midnight secret,2
fres natural indulgent body wash pink cupcake,2
fres natural spray cologne hijab refresh bohemian spirit,2
fres natural spray cologne hijab refresh princess charming,2
fresh living minyak zaitun,2
garnier light complete super uv spf 50 matte finish,2
gatsby eau de toilette white up blanc wood,2
gatsby splash cologne deep ocean,2
giv body wash hijab saffron niacinamide,2
giv body wash hijab tin zaitun,2
glow lovely body wash multivitamin,2
glow lovely ultimate uv duo vitamin c spf 35 pa,2
hanasui body spa exfoliating gel aloe vera,2
hanasui body spa exfoliating gel rainbow,2
herborist lulur trdsional bali whitening milk,2
implora perfect shield sunscreen spf 40 pa,2
indomaret body wash antiseptic,2
indomaret body wash cherry blossom,2
indomaret body wash violet lily,2
indomaret hand sanitizer spray,2
indomaret hand soap camomile,2
indomaret hand soap pump camomile extracts,2
indomaret hand soap strawberry,2
indomaret hand wash antiseptic,2
indomaret hand wash pump antiseptic,2
indomaret hand wash pump cherry blossom,2
instance hand sanitizer liquid spray,2
jf dermamed cleanser,2
kao biore body foam active antibacterial,2
kao biore body foam all in 1 hygienic refresh,2
kao biore body foam refill bright lilac,2
kao biore body foam refill energetic cool,2
kao biore body foam refill lively refresh,2
kao biore body foam relaxing aromatic jasmine,2
kao biore uv oil control matte spf 50pa fresh bright,2
kojiesan skin lightening soap with hydromoist,2
kojiesan sunscreen spf 50 pa face,2
kojiesan sunscreen spf 50 pa sports,2
lifebuoy antibacterial handwash total 10,2
lifebuoy body wash total 10 pump red,2
lifebuoy sabun mandi cair blue cool fresh,2
lifebuoy sabun mandi cair lemon fresh,2
lifebuoy sabun mandi cair mild care,2
lifebuoy sabun mandi cair pump white,2
lifebuoy sabun mandi cair refill japanese shiso mineral clay,2
lifebuoy sabun mandi cair refill red,2
lifebuoy sabun mandi cair refill white,2
lifebuoy sabun mandi cair refill yoghurt care,2
lifebuoy sabun mandi cair total10,2
lifebuoy sanitizer spray,2
loreal uv defender uv serum protector bright clear,2
loreal uv defender uv serum protector matte fresh,2
lux body wash hijab zaitun madu,2
lux sabun cair pink soft touch pump,2
lux sabun cair pink soft touch refill,2
lux sabun mandi cair refill magical orchid,2
marina body lotion rich moisturizing avocado,2
marina hand body lotion natural nutri fresh,2
marina hand body lotion rich moisturizing avocado olive oil,2
marina hand body lotion uv white e collagen asta,2
marina hand body lotion uv white healthy glow,2
marina healthy booster body serum kakadu c,2
marina perfume body spray fresh start,2
morris eau de parfum hijab arafah,2
morris eau de parfum travel creative,2
morris eau de parfum travel paris,2
morris eau de parfum tropical romance,2
mustika ratu minyak zaitun,2
naeem moisturizing body soap taifi rose,2
naeem moisturizing body wash taifi rose,2
natur e skin start hand body lotion moisturizing,2
neutrogena ultra sheer dry  touch sunscren spf 50 ,2
nivea body lotion instant white spf 15,2
nivea body serum super 10 vitamin niacinamide,2
nivea body serum uv extra whitening,2
nivea deo roll on extra whitening,2
nivea deo roll on pearl beauty,2
nivea deo roll on shave less hijab soft,2
nivea deo roll on whitening silk touch,2
nuvo hand sanitizer spray cool breeze,2
nuvo sabun kesehatan cair biru caring,2
nuvo sabun kesehatan cair fresh protect lemon,2
posh body spray perfumed hijab chic green blossom,2
posh body spray perfumed hijab chic purple wish,2
posh deo roll on hijab chic refreshing green,2
pro guard antibacterial body wash active protect,2
pro guard antibacterial body wash skin relief,2
pucelle body mist cologne sparkling love,2
pucelle eau de luxe cologne dainty,2
pucelle eau de luxe cologne finesse,2
pucelle eau de luxe cologne lucent,2
pucelle eau de luxe cologne victress,2
regazza eau de toilette femme purity,2
regazza eau de toilette red passionate,2
regazza eau de toilette white glow,2
rexona deo roll on hijab women peach mint cool,2
rexona deo roll on men motionsense invisibleantibacterial,2
rexona deo roll on men motionsense lime cool,2
rexona deodorant free spirit,2
rexona deodorant rol on women advanced brightening anti noda,2
rexona deodorant roll on women advaced brightening,2
rexona deodorant roll on women dreamy bright,2
rexona deodorant roll on women power dry,2
rexona deodorant roll on women shower clean,2
rexona roll on glowing white,2
romano eau de cologne grandiose,2
saniter air surface sanitizer spray,2
saniter hand sanitizer spray,2
shinzui body cleanser skin lightening matsu,2
shinzui body mist keiko,2
shinzui body scrub skin lightening,2
shinzui body scrub skin lightening kirei,2
shinzui sabun mandi skin lightening kirei,2
shinzui sabun mandi skin lightening matsu,2
