nama,klasifikasi
3 ayam mie telor super kuning,0
3 ayam mie telor super merah,0
5 days croissant cheese,0
7 cereal bar cocoa chia,0
7 cereal bar yoghurt berry,0
abc kecap asin,0
abc kecap manis,0
abc kecap manis daging asap,0
abc kecap manis refill,0
abc kecap manis seafood,0
abc kecap pedas,0
abc kopi instant kopi gula susu,0
abc kopi instant tulus mix bubble gum,0
abc kopi susu instant gula aren,0
abc mi goreng selera pedas ayam pedas limau,0
abc mi goreng selera pedas spicy mayo cheese,0
abc mie cup selera pedas gulai ayam pedas,0
abc mie goreng selera pedas nampol sapi pedas,0
abc mie rebus selera pedas gulai ayam pedas,0
abc sambal,0
abc sambal asli,0
abc sambal bawang pedas,0
abc sambal extra pedas,0
abc sambal fruity nanas jeruk,0
abc sambal geprek,0
abc sambal terasi,0
abc sardines bumbu serundeng goreng,0
abc sardines chili,0
abc sardines extra pedas,0
abc sardines tomat,0
abc sauce tomat,0
abc terasi udang,0
abc mi rebus selera pedas spicy garlic butter cheese,0
adem sari minuman penyejuk,0
agar rasa agar agar powder coklat,0
agnesi lasagne,0
agnesi pasta fettuccine flat,0
agnesi saus tomat bolognese,0
agnesi saus tomat dengan basil,0
agnesi spaghetti,0
air mancur madurasa murni,0
air mancur madurasa original,0
airborne clover honey,0
airborne honeydew madu,0
airborne manuka honey,0
ajinomoto bumbu masak,0
ajinomoto bumbu nasi goreng sajiku ayam,0
ajinomoto bumbu nasi goreng sajiku kecap,0
ajinomoto bumbu nasi goreng sajiku pedas,0
ajinomoto mayonnaise mayumi,0
ajinomoto mayonnaise mayumi pedas,0
ajinomoto penyedap rasa masako ayam,0
ajinomoto penyedap rasa masako gurih pas ayam,0
ajinomoto penyedap rasa masako sapi,0
ajinomoto saus teriyaki saori,0
ajinomoto saus tiram saori,0
ajinomoto tepung bumbu sajiku,0
ajinomoto tepung bumbu sajiku golden crispy,0
ajinomoto tepung bumbu sajiku serbaguna,0
al shifa black forest honey,0
al shifa natural honey squeeze,0
al shifa natural honey,0
amanda margarine dapur,0
amanda minyak goreng refill,0
amh minuman jahe merah,0
anchor boneeto susu bubuk hi calcium creamy vanilla,0
anchor boneeto susu bubuk hi calcium yummy choco,0
anchor cheddar cheese,0
anchor pure new zealand butter salted,0
angsa kecap asin refill,0
anlene actifit hi calcium coklat,0
anlene actifit hi calcium original,0
anlene actifit hi calcium vanila,0
anlene gold susu bubuk hi calcium vanila,0
anlene gold plus hi calcium coklat,0
anlene gold plus hi calcium original,0
anlene gold plus hi calcium vanila,0
anlene gold plus hi calsium coklat,0
anmum susu bubuk ibu hamil emesa coklat,0
anmum susu bubuk ibu hamil materna coklat,0
anmum susu bubuk ibu hamil materna lite coklat,0
anmum susu bubuk ibu hamil materna strawberry white cokelat,0
anmum susu bubuk ibu hamil materna vanilla delight,0
anmum susu bubuk ibu menyusui lacta cokelat,0
anmum susu bubuk ibu menyusui lacta coklat,0
appeton susu bubuk vanilla,0
appeton weigh gain susu bubuk adult chocolate,0
appeton weigh gain susu bubuk adult vanilla,0
arirang mie instant goreng ayam,0
arirang mie instant goreng pedas,0
arirang mie instant kuah sum sum,0
asahi sardines saus pedas,0
asahi sardines saus tomat,0
asahi tuna chunks in vegetable oil,0
ashitaki creammy latte cokelat,0
ashitaki creammy latte matcha,0
ashitaki creamy latte original,0
ashitaki mi goreng ala jepang,0
ashitaki mi goreng original,0
ashitaki mi rebus soto,0
ashitaki shirataki noodle kari pedas,0
ashitaki shirataki noodle mi goreng rendang,0
ashitaki shirataki noodle tom yum,0
atom bulan mie telur,0
ayam brand baked beans in tomato sauce,0
ayam brand mackerel in tomato bulat,0
ayam brand sardines in tomato bulat,0
ayam brand sardines oval,0
ayam brand tuna chunks in oil,0
ayam brand tuna chunks in water,0
ayam brand whole kernel corn in water,0
bakalland crunchy muesli 5 forest fruits honey,0
bakalland crunchy muesli 5 nuts honey,0
bakalland crunchy muesli 5 seeds honey,0
bakalland crunchy muesli 5 tropical fruits honey,0
bakmi mewah instant ayam jamur,0
bamboe bumbu instant nasi goreng,0
bamboe bumbu instant rawon,0
bamboe bumbu instant rendang,0
bamboe bumbu instant soto madura,0
bamboe bumbu instant tom yum,0
bango bumbu mi goreng aceh,0
bango bumbu nasi goreng kambing,0
bango bumbu nasi kuning khas manado,0
bango bumbu opor ayam khas cepu,0
bango bumbu soto betawi,0
bango bumbu tongseng khas solo,0
bango kecap manis,0
bango kecap manis light,0
bango kecap manis refill,0
barco minyak goreng,0
barco minyak goreng refill,0
bawadi coffee arabica blend,0
bawadi coffee arabica gayo speciality premium,0
bawadi coffee robusta blend,0
bawadi coffee robusta gayo premium,0
bawadi coffee robusta gayo special,0
bebelac susu pertumbuhan grogreat madu,0
bebelac susu pertumbuhan grogreat vanila,0
bebelac gold susu bubuk vanilla,0
bejo wedang susu jahe merah,0
bella spread choco cashew,0
beng beng chocolate drink,0
bernardi bumbu nasi goreng,0
bernardi corned beef,0
bernardi sup merah,0
bertolli olive oil classico,0
bertolli olive oil extra light,0
bertolli olive oil extra virgin,0
bestwok mi goreng blackpepper seafood,0
bestwok mi goreng hot spicy,0
bestwok mi goreng original,0
bihophar acacia honey,0
bihophar black forest honey,0
bihun jagung bihun cap tanam jagung,0
bihunku bihun goreng special pedas,0
bihunku bihun instant ayam bawang,0
bihunku bihun instant kari laksa pck,0
bihunku bihun instant korean series spicy kimchi,0
bihunku bihun instant soto spesial,0
bihunku bihun instant korean series japchae,0
bimoli minyak goreng,0
bimoli minyak goreng special refill,0
biondi angel hair,0
biondi elbows,0
biondi fettuccine,0
biondi linguine ,0
biondi macaroni ,0
biondi penne rigate ,0
biondi spagheti,0
biondi spiral,0
biondi trivelle,0
biondi vermicelli,0
biostime susu pertumbuhan bio shield a madu,0
biostime susu pertumbuhan bio shield a vanilla,0
biostime susu bubuk bio shield a madu,0
biostime susu bubuk bio shield a vanilla,0
blenuten minuman serbuk instan vanila,0
blue band margarine cake cookie,0
blue band margarine cake cookies,0
blue band margarine master,0
blue band margarine serbaguna,0
bola deli tepung beras,0
bola deli tepung beras ketan,0
bola dunia agar agar powder coklat,0
bola dunia agar agar powder hijau,0
bola dunia agar agar powder merah,0
bola dunia agar agar powder putih,0
borges olive oil extra light,0
borges olive oil extra virgin,0
borges olive oil pure,0
botan mackarel,0
botan sardines premium in tomato sauce,0
bowin colagen snack bar keju,0
budy jam pindekas,0
budy jam selai coklat,0
budy jam strawberry,0
bumbu kitchen cabe bubuk,0
bumbu kitchen cabe bubuk kasar,0
bumbu kitchen daun sereh bubuk,0
bumbu kitchen kunyit bubuk,0
bumbu kitchen lada putih biji,0
bumbu kitchen parsley,0
bumbu kitchen rosemary,0
burung dara mie kering pipih,0
burung dara mie telur urai original,0
burung dara mie telur urai pipih,0
cadbury hot chocolate drink 3 in 1,0
caffino barista kopi instant 4 in 1 latte coconut,0
caffino bold kopi instant 4 in 1 dark cappuccino,0
caffino kopi instant 3 in 1 bold,0
caffino kopi instant 3 in 1 choco hazelnut,0
caffino kopi instant 3 in 1 classic,0
caffino kopi instant 3 in 1 mocca,0
cakra kembar tepung terigu,0
camar minyak goreng,0
cap botol teh bubuk biru,0
cap botol teh celup hijau,0
cap botol teh celup hijau signature melati,0
cap botol teh celup vintage,0
cap enaak kental manis coklat,0
cap enaak kental manis putih,0
cap enak krimer kental manis putih,0
cap onta minyak samin,0
captain oats instant oatmeal,0
carnation kental manis carnation coffee mate,0
carnation krimer kental manis,0
ceres choco spread choco hazelnut,0
ceres choco spread double hazelnut,0
ceres choco spread duo milk hazelnut,0
ceres hagelslag rice choco classic,0
ceres hagelslag rice choco festive,0
ceres hagelslag rice dark chocolate,0
chek hup kokoo hot chocolate drink,0
chekhup ipoh white coffe 3 in 1 less sweet,0
chekhup ipoh white coffee rich 3 in 1,0
chekhup kokoo chocolate drink 3 in 1 with hazelnut,0
chekhup teh tarik instant 3 in 1 rich creamy,0
chekhup white coffe 3 in 1 original,0
chekhup white coffee 2 in 1 no added sugar,0
chilgo susu pertumbuhan vanila,0
chilgo susu pertumbuhan vanila,0
chocodrink belgian chocolate taste,0
choripdong corn syrup,0
chrysanthemum granule,0
citra putri tepung bumbu serbaguna,0
colatta dark compound chocolate,0
colatta glaze tiramisu,0
cy double hot chocolate drink,0
dancow susu bubuk pertumbuhan vanilla,0
dancow susu bubuk nutritods madu,0
dancow susu bubuk nutritods vanilla,0
dancow susu bubuk instant calci n madu,0
dancow susu bubuk protectus probio madu,0
dancow susu bubuk protectus probio vanila,0
dancow fortigro susu bubuk anak instant,0
dancow fortigro susu bubuk cokelat,0
dancow fortigro susu bubuk full cream,0
dancow fortigro susu bubuk instant,0
date crown kurma premium emirates,0
del monte chilli sauce extra hot,0
del monte extra hot chilli sauce,0
del monte ketchup sauce tomat,0
del monte tasty chilli sauce,0
delfi hot cocoa indulgence,0
delima minyak goreng refill,0
delmonte chili sauce extra hot,0
delmonte chilli sauce extra hot,0
delmonte fresh cut whole kernel corn,0
delmonte ketchup sauce tomat,0
delmonte ketchup saus tomat,0
delmonte sauce tomat,0
delmonte spaghetti sauce,0
diabetamil sweetener,0
diabetasol susu formula diabetes cappuccino,0
diabetasol susu formula diabetes coklat,0
diabetasol susu formula diabetes vanila,0
diabetasol susu formula diabetes vita digest cappuccino,0
diabetasol susu formula diabetes vita digest cokelat,0
diabetasol susu formula diabetes vita digest coklat,0
diabetasol susu formula diabetes vita digest vanila,0
diabetasol susu formula diabetes vita digest vanilla,0
diabetasol zero calorie sweetener,0
diabetasol zero calorie sweetener,0
dolphin garam,0
dolpin garam meja,0
doonmalai beras basmati,0
dougo canola oil,0
dua belibis sambal terasi,0
dua belibis saus cabe,0
dua belibis value saus cabe,0
dveggie sambal tabur daun jeruk,0
dveggie sambal tabur original,0
dveggie sambal tabur rumput laut,0
edo mini pau coklat,0
ellenka fiber creme,0
ellenka rich creme non dairy creamer,0
emina block cheese mozza,0
emina block shred cheese,0
emina cheese slice mozza,0
enak eco bumbu pecel pedas,0
enam tiga premium tea assorted,0
energen cereal susu instant vanilla,0
energen cereal instant champion coklat,0
energen cereal instant chocolate,0
energen cereal instant jahe,0
energen cereal instant kacang hijau,0
energen cereal instant kurma,0
energen cereal instant vanilla,0
energen sereal susu cokelat,0
energen sereal susu vanila,0
enfamil susu bubuk formula bayi gentle care,0
ensure gold nutrition powder fos gandum,0
ensure gold nutrition powder fos vanilla,0
ensure nutrition powder fos coklat,0
ensure nutrition powder fos vanila,0
ensure nutrition powder fos vanilla,0
entrakid minuman serbuk cokelat,0
entrakid minuman serbuk vanila,0
entramix nutrisi bubuk coklat,0
entramix nutrisi bubuk vanilla,0
entrasol active susu bubuk chocolate,0
entrasol active susu bubuk vanilla latte,0
entrasol gold susu bubuk coklat,0
entrasol gold susu bubuk vanila,0
entrasol platinum susu bubuk vanila,0
entrasol platinum susu bubuk vanilla,0
excelso kopi arabica,0
excelso kopi bubuk arabica gold,0
excelso kopi bubuk java arabica,0
excelso kopi bubuk kalosi toraja,0
excelso kopi bubuk luwak toraja,0
excelso kopi bubuk robusta gold,0
excelso kopi bubuk sumatera mandheling,0
fermipan instant yeast,0
fiesta mackerel in chili sauce,0
fiesta ready to serve chicken teriyaki,0
fiesta rts chicken rendang,0
filippo berio olive oil,0
filippo berio olive oil extra light,0
filippo berio olive oil extra virgin,0
filippo berio olive oil extra virgin spray,0
filippo berio olive oil mild light spray,0
filma margarine bernutrisi,0
filma margarine serbaguna,0
filma minyak goreng refill,0
finna king lobster fish sauce,0
finna sambal ijo asli uleg,0
finna sambal pedas sebaguna uleg,0
finna sambal terasi uleg,0
finna sambal udang renyah,0
finna tepung roti panko,0
fitbar cheese fitbar,0
fitbar chocolate fitbar,0
fitbar fruit fitbar kismis raspbery,0
fitbar tiramisu fitbar,0
fitmee mie instant goreng pedas,0
fitri margarine serba guna,0
flora madu tropis,0
fortune minyak goreng refill,0
forvita margarine,0
forvita margarine gold,0
foxs fusion tea lychee,0
foxs fusion tea mix berries,0
foxs instant pudding milk chocolate,0
foxs instant pudding strawberry,0
fresco kopi instant cappuccino,0
fresco kopi krim susu,0
fresco kopi gula,0
frisian flag susu bubuk pertumbuhan madu,0
frisian flag 1 susu bubuk pertumbuhan vanila,0
frisian flag 3 susu bubuk pertumbuhan madu,0
frisian flag 3 susu bubuk pertumbuhan vanila,0
frisian flag canister kental manis coklat,0
frisian flag canister kental manis putih,0
frisian flag gold kental manis putih,0
frisian flag gold susu kental manis putih,0
frisian flag kental manis cokelat,0
frisian flag kental manis coklat,0
frisian flag kental manis putih,0
frisian flag krimer kental manis omela,0
frisian flag susu bubuk instant kompleta,0
frisian flag susu bubuk instant kompleta chocolate,0
frisian flag susu bubuk instant kompleta vanila,0
frisian flag susu kental manis coklat,0
fs beras hitam,0
fs beras japonica,0
fs beras ketan hitam,0
fs beras ketan putih,0
fs beras long grain,0
fs beras merah,0
fukumi beras porang,0
gadjah kopi tubruk asli,0
gadjah kopi tubruk manis 2 in 1,0
gaga mie goreng 100 extra pedas jalapeno,0
gaga mie instant 100 extra pedas kuah jalapeno,0
gaga mie instant 100 extra pedas kuah soto,0
gaga sardines chili tomato,0
gaga sardines tomat chilli,0
goldenfil spread choco crunchy,0
good day coffee freeze 3 in 1 cookies n cream,0
good day coffee freeze 3 in 1 hazelnut macchiato,0
good day coffee freeze 3in1 cookies n cream,0
good day kopi instant 3 in 1 carrebian nut,0
good day kopi instant 3 in 1 chococinno,0
good day kopi instant 3 in 1 coolin coffee,0
good day kopi instant 3 in 1 duet mocacaramel,0
good day kopi instant 3 in 1 mocacinno,0
good day kopi instant 3 in 1 vanilla latte,0
good day kopi instant cappuccino coklat granul,0
goody pudding with nata de coco lychee,0
goody pudding with nata de coco mango,0
goody pudding with nata de coco mixed,0
granolab australian baked oats dark chocolate almond,0
granolab australian baked oats fruit nut,0
granolab australian baked oats original honey,0
granolab australian baked oats peanut butter belgian chocolate,0
granolab muesli oat crunch abon sapi,0
granolab muesli oat crunch berry yogurt,0
granolab muesli oat crunch cheese almond,0
granolab muesli oat crunch chocotella,0
green valley grated parmesan cheese,0
green valley macaroni cheese,0
green valley macaroni cheese alfredo,0
green valley macaroni cheese chilli,0
gulaku gula tebu kuning,0
gulaku gula tebu putih premium,0
gulare gula pasir premium putih,0
gunung agung tepung tapioka,0
gurih ya bumbu tabur aonori cheese,0
gurih ya bumbu tabur nori bonito,0
gurih ya bumbu tabur original nori,0
gurih ya bumbu tabur spicy nori,0
haan ice cream mix chocolate,0
haan ice cream mix strawberry,0
haan instant brownies,0
haan instant pudding cokelat,0
haan instant pudding mangga,0
haan pancake mix vanilla,0
haan ragi instant,0
haan wippy cream,0
happy soya minyak goreng refill,0
harada green tea bag,0
harada green tea bag with brown rice,0
harumas minyak goreng,0
haverjoy instant oats box,0
heinz indonesian gourmet chili saus,0
heinz korean gourmet chili saus,0
heinz mexican gourmet chili saus,0
heinz tomato ketchup,0
hijra kurma tunisia,0
hilo active susu bubuk hi calcium es teler,0
hilo active susu bubuk hi calcium ketan hitam,0
hilo gold susu bubuk hi calcium chocolate,0
hilo gold susu bubuk hi calcium original,0
hilo gold susu bubuk hi calcium vanilla,0
hilo gold susu bubuk nutrifit sweet potato,0
hilo school susu bubuk hi calcium bubble gum,0
hilo school susu bubuk hi calcium chocolate,0
hilo school susu bubuk hi calcium cotton candy,0
hilo school susu bubuk hi calcium strawberry cheese,0
hilo school susu bubuk hi calcium vanila vegiberi,0
hilo susu bubuk hi calcium platinum swiss chocolate,0
hilo teen susu bubuk hi calcium chocolate,0
hilo teen susu bubuk hi calcium coklat,0
hilo teen susu bubuk hi calcium popcorn caramel,0
hilo teen susu bubuk hi calcium taro,0
hilo teen susu bubuk hi calcium vanila caramel,0
hilo teen susu bubuk hi calsium vanilla caramel,0
hilo yogurt smoothie bowl strawberry,0
home vermicelli soun longkou,0
honig macaroni elbow,0
huwi silky pudding chocolate,0
huwi silky pudding lychee,0
huwi silky pudding mango,0
huwi silky pudding strawberry,0
huwi silky pudding taro,0
huwi soft pudding blackforest,0
huwi soft pudding bubblegum,0
huwi soft pudding green tea,0
huwi soft pudding thai tea,0
huwi soft pudding tiramisu,0
ibu yuty bumbu pecel madiun,0
ikan dorang minyak kelapa special,0
ikan dorang virgin coconut oil,0
indocafe cappuccino,0
indocafe coffee mix,0
indocafe coffee mix 3 in 1,0
indocafe coffee mix jahe,0
indocafe coffee mix mild,0
indocafe coffee mix rich strong,0
indocafe kopi instant fine blend,0
indocafe kopi instant original blend,0
indocafe white coffee,0
indofood bumbu kaldu cube ayam,0
indofood bumbu kaldu cube sapi,0
indofood bumbu kentang goreng barbekiu,0
indofood bumbu kentang goreng jagung bakar,0
indofood bumbu kentang goreng keju,0
indofood bumbu racik ayam goreng,0
indofood bumbu racik ikan goreng,0
indofood bumbu racik nasi goreng,0
indofood bumbu racik nasi goreng spesial sosis,0
indofood bumbu racik sayur asem,0
indofood bumbu racik sayur sop,0
indofood bumbu racik tempe goreng,0
indofood bumbu spesial racik gulai,0
indofood bumbu spesial racik kare,0
indofood bumbu spesial racik opor ayam,0
indofood bumbu spesial racik rawon,0
indofood bumbu spesial racik rendang,0
indofood bumbu spesial racik soto ayam,0
indofood kecap asin,0
indofood kecap manis,0
indofood kecap refill manis,0
indofood sambal ala bangkok asam manis,0
indofood sambal ekstra pedas,0
indofood sambal extra pedas,0
indofood sambal pedas,0
indofood sambal pedas dahsyat,0
indofood sambal rumahan sambal balado,0
indofood saus tomat,0
indofood tepung bumbu racik ayam krispi,0
indofood tepung bumbu racik bakwan,0
indofood tepung bumbu racik serbaguna,0
indomaret abon sapi,0
indomaret bawang merah goreng,0
indomaret beras kepala super premium,0
indomaret beras kristal,0
indomaret beras long grain premium,0
indomaret beras merah,0
indomaret beras pulen wangi premium,0
indomaret beras ramos super,0
indomaret beras super pandan wangi,0
indomaret bihun beras,0
indomaret bumbu biji kemiri,0
indomaret bumbu ketumbar,0
indomaret bumbu lada putih,0
indomaret chocolate meises,0
indomaret coklat meises,0
indomaret coklat meises mix,0
indomaret cuka,0
indomaret garam,0
indomaret gula aren,0
indomaret gula aren stick,0
indomaret gula batu,0
indomaret gula halus,0
indomaret gula merah,0
indomaret gula pasir premium kuning,0
indomaret gula pasir premium putih,0
indomaret gula pasir stick,0
indomaret instant cup noodle ayam pedas,0
indomaret jam pineapple,0
indomaret jam strawberry,0
indomaret kacang hijau,0
indomaret ketan hitam,0
indomaret ketan putih,0
indomaret madu asli,0
indomaret minyak goreng,0
indomaret santan kelapa,0
indomaret spread chocolate,0
indomaret teh hijau celup melati,0
indomaret teh hitam celup,0
indomaret ufo mi goreng ala indonesia,0
indomaret ufo mi goreng pedas,0
indomie mi instan ayam bawang,0
indomie mi instan ayam special,0
indomie mi instan goreng aceh,0
indomie mi instan goreng ayam geprek,0
indomie mi instan goreng iga penyet,0
indomie mi instan goreng jumbo ayam panggang,0
indomie mi instan goreng jumbo special,0
indomie mi instan goreng plus special,0
indomie mi instan goreng rendang,0
indomie mi instan goreng rica rica,0
indomie mi instan hype seblak hot jeletot,0
indomie mi instan kaldu ayam,0
indomie mi instan kari ayam,0
indomie mi instan keriting ayam panggang,0
indomie mi instan keriting goreng special,0
indomie mi instan soto lamongan,0
indomie mi instan soto mie,0
indomie mi instan soto padang,0
indomie mi instan soto spesial,0
indomie mie goreng ayam pop,0
indomie mie goreng kebab rendang,0
indomie mie goreng premium japanese takoyaki,0
indomie mie instant hype mieghetti bolognese,0
indomie mie instant khas kal sel soto banjar kuit,0
indomie mie instant premium japanese shoyu ramen,0
indomie mie instant premium japanese tori miso ramen,0
indomilk kental manis chocolate,0
indomilk kental manis coklat,0
indomilk kental manis putih,0
indomilk kental manis swiss choco,0
indomilk susu bubuk instant omega 3,0
indomilk susu bubuk omega 3 coklat,0
indomilk susu bubuk omega 3 full cream,0
indomilk susu kental manis putih,0
isomil plus susu bubuk advance soya,0
jawara cabai tabur bawang goreng,0
jawara cabai tabur jambal,0
jawara saus sambal extra hot,0
jawara saus sambal hot,0
jempol sambal pedas,0
jempol sambal pedas manis,0
jempol sambal sea food,0
jempol sambal vegetarian,0
jj royal aceh gayo arabica coffee,0
jj royal bali arabica coffee,0
jj royal cafe royal kopi lanang,0
jj royal cafe royal paradise arabica,0
jj royal cafe royal tropical robusta,0
jj royal kopi tubruk cafe latte,0
jj royal kopi tubruk caramel latte,0
jj royal kopi tubruk mocha latte,0
jj royal lampung robusta coffee,0
jj royal mandheling arabica coffee,0
jj royal toraja arabica coffee,0
kaimono gula aren cair,0
kaimono gula aren kuning,0
kalduku bumbu kaldu blok 40s ayam,0
kalduku bumbu kaldu blok 40s sapi,0
kalduku bumbu kaldu blok 40s udang,0
kapal api kopi bubuk,0
kapal api kopi bubuk gula aren special mix,0
kapal api kopi bubuk less sugar special mix,0
kapal api kopi bubuk luwak blend,0
kapal api kopi bubuk morning blend,0
kapal api kopi bubuk special,0
kapal api kopi bubuk special merah,0
kapal api kopi bubuk special mix,0
kapal api kopi bubuk super,0
kapal api kopi bubukgula mantap,0
kapal api kopi instant 3 in 1 grande java latte,0
kapal api kopi instant 3 in 1 white coffee,0
kapal api kopi susu,0
kapal api krim kafe,0
kapal api krim kafe non dairy creamer,0
kelloggs cereal corn flakes,0
kelloggs cereal corn flakes banana,0
kelloggs cereal corn flakes classic,0
kelloggs cereal corn flakes honey crunch,0
kelloggs cereal corn flakes strawberry,0
kelloggs cereal froot loops,0
kepala djenggot teh celup green tea,0
kewpie mayonnaise original,0
kewpie roasted sesame wijen sangrai,0
kewpie saus siram kecap ala jepang,0
kewpie saus siram thousand island,0
kewpie saus siram tomat pedas,0
kewpie saus siram wijen sangrai,0
kikkoman kecap asin khas jepang,0
kikkoman kecap asin khas jepang dispenser,0
kikkoman saus bulgogi,0
kikkoman saus bumbu tiram,0
kikkoman saus manis khas jawa,0
kikkoman saus pedas ala korea,0
kikkoman saus teriyaki bawang,0
kimbo kitchen bubur instant ayam,0
kimbo kitchen bubur instant sapi,0
kings fisher sarden goreng balado,0
kiwi fruit hijau,0
knorr chicken seasoning powder,0
knorr demi glace brown sauce mix,0
knorr oyster flavoured sauce,0
ko rasa kecap fermentasi tempe manis pedas,0
ko rasa saus fermentasi tempe pedas asli,0
ko rasa saus sambal fermentasi tempe cabe hijau,0
ko rasa saus sambal fermentasi tempe ekstra pedas,0
kobe bon cabe bumbu rujak buah level 10,0
kobe bon cabe cabai kering berbumbu original,0
kobe bon cabe sambal tabur ikan roa level 15,0
kobe bon cabe sambal tabur level 15,0
kobe bon cabe sambal tabur level 30,0
kobe bon cabe sambal tabur max end level 50,0
kobe bon cabe sambal tabur nori level 3,0
kobe bon cabe sambal tabur refill ebi kriuk level 2,0
kobe bon cabe sambal tabur refill original level 15,0
kobe bon cabe sambal tabur refill original level 30,0
kobe bon cabe sambal tabur refill teri level 3,0
kobe bumbu aduk nasi uduk,0
kobe bumbu nasi goreng super pedas,0
kobe jiwa pagi mie goreng,0
kobe jiwa pagi mie instant soto segeer,0
kobe mie goreng boncabe level 15,0
kobe mie instant boncabe level 30 ramen pedas,0
kobe saus tiram selera,0
kobe tepung bumbu bakwan kress,0
kobe tepung bumbu kentucky super crispy,0
kobe tepung bumbu serbaguna premium,0
kobe tepung roti,0
kobe tepung tempe kriuk,0
koepoe koepoe baking powder,0
koepoe koepoe bawang putih bubuk,0
koepoe koepoe bubuk ketumbar,0
koepoe koepoe kayumanis bubuk,0
koepoe koepoe lada halus putih,0
koepoe koepoe lada putih bubuk,0
koepoe koepoe pasta chocolate,0
koepoe koepoe pasta pandan,0
koepoe koepoe perisa vanilla crystal,0
koepoe koepoe soda kue btl,0
koepoe koepoe tbm besar,0
koepoe koepoe bumbu spekoek,0
koepoe koepoe ovalett,0
koepoe koepoe pasta mocca,0
koepoe koepoe pasta vanilla,0
koepoe koepoe pewarna makanan oil based coklat,0
koepoe koepoe pewarna makanan oil based hijau,0
koepoe koepoe pewarna makanan oil based kuning,0
koepoe koepoe pewarna makanan oil based merah,0
koepoe koepoe sp,0
kokita tauco super,0
kongbap multi grain mix,0
kongbap multi grain mix chia seed quinoa,0
kraft cheese quick melt mozza,0
kraft keju all in 1 box,0
kraft keju cheddar olahan,0
kraft keju high calcium singles 10 slice,0
kraft keju high calcium singles 5 slice,0
kraft milky soft,0
krisma food garlic chicken floss egg roll,0
kunci biru tepung terigu,0
kurma khalas date crown,0
la fancy bawang bombay bubuk,0
la fancy bumbu ngo hiong,0
la fancy cengkeh bubuk,0
la fancy daun oregano,0
la fancy daun sage,0
la fancy daun salam,0
la fancy daun thyme,0
la fancy jinten bubuk,0
la fancy kayu manis bubuk,0
la fancy ketumbar bubuk,0
la fancy kunyit bubuk,0
la fancy merica hitam biji,0
la fancy merica hitam bubuk,0
la fancy merica hitam remah,0
la fancy merica putih biji,0
la fancy merica putih bubuk,0
la fancy pala bubuk,0
la fancy paprika bubuk,0
la fancy pekak bubuk,0
la fancy pekak utuh,0
la fonte fettuccine,0
la fonte lasagna,0
la fonte macaroni elbow,0
la fonte makaroni pazto instant keju,0
la fonte pasta sauce bolognese,0
la fonte pasta sauce chkn bolognese,0
la fonte spaghetti,0
la fonte spaghetti instant saus ayam,0
la fonte spaghetti instant saus bolognese,0
lactamil susu bubuk ibu hamil pregnasis cokelat,0
lactamil susu bubuk ibu hamil pregnasis coklat,0
ladaku merica bubuk,0
ladang lima korean noodle kuah beef mushroom,0
ladang lima tepung bumbu serbaguna,0
ladang lima tepung mocaf,0
lagie choco chips,0
lagie hegel slag safari polos,0
larisst beras kepala super,0
larisst beras premium,0
